impound_no,Animal_ID,Data_Source,Record_Type,Link,Current_Location,Animal_Name,animal_type,Age,Animal_Gender,Animal_Breed,Animal_Color,Date,Date_Type,Obfuscated_Address,City,State,Zip,jurisdiction,obfuscated_latitude,obfuscated_longitude,Image,image_alt_text,Memo,Temperament
K19-114622,A577662,Regional Animal Services of King County,FOUND,https://petharbor.com/PublicDetail.asp?searchtype=PUBFOUND&view=sysadm.v_animal&shelterlist='KING'&where=type&ID=1947502,In Public Home,,Dog,,Male,Havanese,Brown / Black,01/01/2019 12:00:00 AM,Date Found,10800 NE 64TH ST,KIRKLAND,WA,98033,KIRKLAND,,,https://petharbor.com/get_image.asp?RES=Detail&LOCATION=PUBLIC&ID=1947502,Image Copyright HLP Inc. 2019,,
K19-114625,A577665,Regional Animal Services of King County,LOST,https://petharbor.com/PublicDetail.asp?searchtype=PUBFOUND&view=sysadm.v_animal&shelterlist='KING'&where=type&ID=1947621,LOST,Shorty,Dog,,Male,Labrador Retriever,Yellow,01/01/2019 12:00:00 AM,Date Lost,27400 212TH PL SE,MAPLE VALLEY,WA,98038,MAPLE VALLEY,,,https://petharbor.com/get_image.asp?RES=Detail&LOCATION=PUBLIC&ID=1947621,Image Copyright HLP Inc. 2019,,
K19-114702,A577893,Regional Animal Services of King County,LOST,https://petharbor.com/PublicDetail.asp?searchtype=PUBFOUND&view=sysadm.v_animal&shelterlist='KING'&where=type&ID=1948831,LOST,Cole,Cat,,Male,Domestic Shorthair,Unknown,01/02/2019 12:00:00 AM,Date Lost,FAIRVIEW AVE N,,,,JURISDICTION,,,https://petharbor.com/get_image.asp?RES=Detail&LOCATION=PUBLIC&ID=1948831,Image Copyright HLP Inc. 2019,,
K19-114704,A577895,Regional Animal Services of King County,LOST,https://petharbor.com/PublicDetail.asp?searchtype=PUBFOUND&view=sysadm.v_animal&shelterlist='KING'&where=type&ID=1948917,LOST,Tater Tot,Dog,,Female,Pembroke Welsh Corgi,Unknown,01/04/2019 12:00:00 AM,Date Lost,200 PARK PL N,RENTON,WA,98057,RENTON,,,https://petharbor.com/get_image.asp?RES=Detail&LOCATION=PUBLIC&ID=1948917,Image Copyright HLP Inc. 2019,,
K19-114706,A577897,Regional Animal Services of King County,FOUND,https://petharbor.com/PublicDetail.asp?searchtype=PUBFOUND&view=sysadm.v_animal&shelterlist='KING'&where=type&ID=1948960,In Public Home,,Dog,,Male,Rottweiler,Black / Brown,01/04/2019 12:00:00 AM,Date Found,S 129TH ST AND 76TH AVE,,,,JURISDICTION,,,https://petharbor.com/get_image.asp?RES=Detail&LOCATION=PUBLIC&ID=1948960,Image Copyright HLP Inc. 2019,,
K19-114713,A577905,Regional Animal Services of King County,LOST,https://petharbor.com/PublicDetail.asp?searchtype=PUBFOUND&view=sysadm.v_animal&shelterlist='KING'&where=type&ID=1949214,LOST,Freya,Dog,,Female,American Pit Bull Terrier,Unknown,01/05/2019 12:00:00 AM,Date Lost,13000 20TH AVE S,SEATAC,WA,98168,SEATAC,,,https://petharbor.com/get_image.asp?RES=Detail&LOCATION=PUBLIC&ID=1949214,Image Copyright HLP Inc. 2019,,
K19-114722,A577913,Regional Animal Services of King County,FOUND,https://petharbor.com/PublicDetail.asp?searchtype=PUBFOUND&view=sysadm.v_animal&shelterlist='KING'&where=type&ID=1949384,In Public Home,,Dog,,Female,Labrador Retriever,White,01/06/2019 12:00:00 AM,Date Found,4800 139TH AVE SE,BELLEVUE,WA,98006,BELLEVUE,47.558295,-122.155875,https://petharbor.com/get_image.asp?RES=Detail&LOCATION=PUBLIC&ID=1949384,Image Copyright HLP Inc. 2019,,
K19-114746,A578100,Regional Animal Services of King County,LOST,https://petharbor.com/PublicDetail.asp?searchtype=PUBFOUND&view=sysadm.v_animal&shelterlist='KING'&where=type&ID=1950265,LOST,Chi Chi,Dog,,Female,Chihuahua - Long Haired,Unknown,01/08/2019 12:00:00 AM,Date Lost,3000 DIVISION ST,ENUMCLAW,WA,98022,ENUMCLAW,,,https://petharbor.com/get_image.asp?RES=Detail&LOCATION=PUBLIC&ID=1950265,Image Copyright HLP Inc. 2019,,
K19-114766,A578150,Regional Animal Services of King County,LOST,https://petharbor.com/PublicDetail.asp?searchtype=PUBFOUND&view=sysadm.v_animal&shelterlist='KING'&where=type&ID=1950637,LOST,Beau Jangles,Dog,,Male,Pit Bull,Unknown,01/02/2019 12:00:00 AM,Date Lost,160TH AND WOODLAND,,,,JURISDICTION,,,https://petharbor.com/get_image.asp?RES=Detail&LOCATION=PUBLIC&ID=1950637,Image Copyright HLP Inc. 2019,,
K19-114765,A578149,Regional Animal Services of King County,LOST,https://petharbor.com/PublicDetail.asp?searchtype=PUBFOUND&view=sysadm.v_animal&shelterlist='KING'&where=type&ID=1950634,LOST,Cooper,Dog,,Male,Pit Bull,Unknown,01/02/2019 12:00:00 AM,Date Lost,6500 163RD STREET CT E,PUYALLUP,WA,98375,PIERCE COUNTY,,,https://petharbor.com/get_image.asp?RES=Detail&LOCATION=PUBLIC&ID=1950634,Image Copyright HLP Inc. 2019,,
K19-114768,A578168,Regional Animal Services of King County,LOST,https://petharbor.com/PublicDetail.asp?searchtype=PUBFOUND&view=sysadm.v_animal&shelterlist='KING'&where=type&ID=1950756,LOST,Marie,Cat,,Female,Domestic Shorthair,Unknown,01/09/2019 12:00:00 AM,Date Lost,8600 SE 75TH PL,MERCER ISLAND,WA,98040,MERCER ISLAND,,,https://petharbor.com/get_image.asp?RES=Detail&LOCATION=PUBLIC&ID=1950756,Image Copyright HLP Inc. 2019,,
K19-114803,A578217,Regional Animal Services of King County,LOST,https://petharbor.com/PublicDetail.asp?searchtype=PUBFOUND&view=sysadm.v_animal&shelterlist='KING'&where=type&ID=1951284,LOST,Thai,Dog,,Male,Golden Retriever,Unknown,01/11/2019 12:00:00 AM,Date Lost,CORNER 148 AVE NE & REDMOND WAY,,,,JURISDICTION,,,https://petharbor.com/get_image.asp?RES=Detail&LOCATION=PUBLIC&ID=1951284,Image Copyright HLP Inc. 2019,,
K19-114811,A578220,Regional Animal Services of King County,LOST,https://petharbor.com/PublicDetail.asp?searchtype=PUBFOUND&view=sysadm.v_animal&shelterlist='KING'&where=type&ID=1951474,LOST,Duke,Dog,,Male,Australian Cattle Dog,Unknown,01/11/2019 12:00:00 AM,Date Lost,240 NW GILMAN,,,,JURISDICTION,,,https://petharbor.com/get_image.asp?RES=Detail&LOCATION=PUBLIC&ID=1951474,Image Copyright HLP Inc. 2019,,
K19-114859,A578339,Regional Animal Services of King County,FOUND,https://petharbor.com/PublicDetail.asp?searchtype=PUBFOUND&view=sysadm.v_animal&shelterlist='KING'&where=type&ID=1952272,In Public Home,,Cat,,,Domestic Mediumhair,Black / White,01/13/2019 12:00:00 AM,Date Found,124TH PLACE SE & SE 277TH PL,KENT,WA,98030,KENT,,,https://petharbor.com/get_image.asp?RES=Detail&LOCATION=PUBLIC&ID=1952272,Image Copyright HLP Inc. 2019,,
K19-114892,A578439,Regional Animal Services of King County,FOUND,https://kingcounty.gov/depts/regional-animal-services/about-us/overview.aspx,,,Dead Cat,4 MONTHS,Unaltered,Domestic Shorthair,Brn Tabby / White,01/16/2019 12:00:00 AM,Received on,400 237TH AVE SE,SAMMAMISH,WA,98074,SAMMAMISH,47.605407,-122.023298,,Image Copyright HLP Inc. 2019,"Received on: 2019-01-16<p/> Found Near: 400 237TH AVE SE, SAMMAMISH WA 98074<p/> Description: Brn Tabby / White Unaltered Domestic Shorthair Cat<p/> Age: 4 MONTHS<p/>",
K19-114895,A578443,Regional Animal Services of King County,FOUND,https://kingcounty.gov/depts/regional-animal-services/about-us/overview.aspx,,,Dead Cat,NO AGE,Unaltered,Not Provided,Black,01/16/2019 12:00:00 AM,Received on,11300 SE KENT KANGLEY RD,KENT,WA,98030,KENT,,,,Image Copyright HLP Inc. 2019,"Received on: 2019-01-16<p/> Found Near: 11300 SE KENT KANGLEY RD, KENT WA 98030<p/> Description: Black Unaltered Not Provided Cat<p/> Age: NO AGE<p/>",
K19-114896,A578442,Regional Animal Services of King County,FOUND,https://kingcounty.gov/depts/regional-animal-services/about-us/overview.aspx,,,Dead Cat,NO AGE,Unaltered,Not Provided,Black,01/16/2019 12:00:00 AM,Received on,11300 SE KENT KANGLEY RD,KENT,WA,98030,KENT,,,,Image Copyright HLP Inc. 2019,"Received on: 2019-01-16<p/> Found Near: 11300 SE KENT KANGLEY RD, KENT WA 98030<p/> Description: Black Unaltered Not Provided Cat<p/> Age: NO AGE<p/>",
K19-114897,A578441,Regional Animal Services of King County,FOUND,https://kingcounty.gov/depts/regional-animal-services/about-us/overview.aspx,,,Dead Cat,NO AGE,Unaltered,Not Provided,Black,01/16/2019 12:00:00 AM,Received on,11300 SE KENT KANGLEY RD,KENT,WA,98030,KENT,,,,Image Copyright HLP Inc. 2019,"Received on: 2019-01-16<p/> Found Near: 11300 SE KENT KANGLEY RD, KENT WA 98030<p/> Description: Black Unaltered Not Provided Cat<p/> Age: NO AGE<p/>",
K19-114812,A578221,Regional Animal Services of King County,FOUND,https://petharbor.com/pet.asp?uaid=KING.A578221,"King County Pet Adoption Center 21615 64TH AVE S KENT, WA 98032",Orion,Cat,5 YEARS,Neutered Male,Domestic Shorthair,White / Org Tabby,01/12/2019 12:00:00 AM,Received on,9600 S 248TH ST,KENT,WA,98030,KENT,,,https://petharbor.com/get_image.asp?RES=Detail&LOCATION=KING&ID=A578221,Image Copyright HLP Inc. 2019,"Received on: 2019-01-12<p/> Found Near: 9600 S 248TH ST, KENT WA 98030<p/> Description: White / Org Tabby Neutered Male Domestic Shorthair Cat<p/> Age: 5 YEARS<p/> Current Location: King County Pet Adoption Center 21615 64TH AVE S KENT, WA 98032<p/>",GREEN
K19-114889,A578435,Regional Animal Services of King County,LOST,https://petharbor.com/PublicDetail.asp?searchtype=PUBFOUND&view=sysadm.v_animal&shelterlist='KING'&where=type&ID=1952667,LOST,Sylvester,Cat,,Male,Domestic Mediumhair,Unknown,01/13/2019 12:00:00 AM,Date Lost,500 N 169TH ST,SHORELINE,WA,98133,SHORELINE,,,https://petharbor.com/get_image.asp?RES=Detail&LOCATION=PUBLIC&ID=1952667,Image Copyright HLP Inc. 2019,,
K19-114907,A578523,Regional Animal Services of King County,FOUND,https://petharbor.com/PublicDetail.asp?searchtype=PUBFOUND&view=sysadm.v_animal&shelterlist='KING'&where=type&ID=1952865,In Public Home,,Dog,,Female,Rottweiler,Black / Brown,01/05/2019 12:00:00 AM,Date Found,300 MICHAEL AVE,ENUMCLAW,WA,98022,ENUMCLAW,,,https://petharbor.com/get_image.asp?RES=Detail&LOCATION=PUBLIC&ID=1952865,Image Copyright HLP Inc. 2019,,
K19-114944,A578634,Regional Animal Services of King County,FOUND,https://kingcounty.gov/depts/regional-animal-services/about-us/overview.aspx,,,Dead Cat,NO AGE,Female,Domestic Shorthair,Tortie,01/18/2019 12:00:00 AM,Received on,9600 22ND AVE SW,SEATTLE,WA,98106,KING COUNTY,47.517231,-122.361763,,Image Copyright HLP Inc. 2019,"Received on: 2019-01-18<p/> Found Near: 9600 22ND AVE SW, SEATTLE WA 98106<p/> Description: Tortie Female Domestic Shorthair Cat<p/> Age: NO AGE<p/>",
K19-114956,A553693,Regional Animal Services of King County,FOUND,https://kingcounty.gov/depts/regional-animal-services/about-us/overview.aspx,,,Dead Cat,2 YEARS 10 MONTHS,Spayed Female,Domestic Shorthair,Brn Tabby / White,01/18/2019 12:00:00 AM,Received on,20000 92ND AVE S,KENT,WA,98031,KENT,47.422798,-122.218062,,Image Copyright HLP Inc. 2019,"Received on: 2019-01-18<p/> Found Near: 20000 92ND AVE S, KENT WA 98031<p/> Description: Brn Tabby / White Spayed Female Domestic Shorthair Cat<p/> Age: 2 YEARS 10 MONTHS<p/>",
K19-114968,A578667,Regional Animal Services of King County,FOUND,https://kingcounty.gov/depts/regional-animal-services/about-us/overview.aspx,,,Dead Cat,NO AGE,Female,Domestic Shorthair,Black,01/19/2019 12:00:00 AM,Received on,17600 140TH AVE SE,RENTON,WA,98058,KING COUNTY,,,,Image Copyright HLP Inc. 2019,"Received on: 2019-01-19<p/> Found Near: 17600 140TH AVE SE, RENTON WA 98058<p/> Description: Black Female Domestic Shorthair Cat<p/> Age: NO AGE<p/>",
K19-114931,A578594,Regional Animal Services of King County,FOUND,https://petharbor.com/PublicDetail.asp?searchtype=PUBFOUND&view=sysadm.v_animal&shelterlist='KING'&where=type&ID=1953114,In Public Home,,Dog,,Male,German Shepherd,Brown / Black,01/17/2019 12:00:00 AM,Date Found,SW 356TH & 13TH AVE SW,,,,JURISDICTION,,,https://petharbor.com/get_image.asp?RES=Detail&LOCATION=PUBLIC&ID=1953114,Image Copyright HLP Inc. 2019,,
K18-110764,A449513,Regional Animal Services of King County,ADOPTABLE,https://kingcounty.gov/depts/regional-animal-services/about-us/overview.aspx,In RASKC Foster Home,Lily,Cat,12 YEARS 9 MONTHS,Spayed Female,Domestic Longhair,Org Tabby,07/28/2018 12:00:00 AM,Received on,21615 64TH AVE S,KENT,WA,98032,AUBURN,47.407788,-122.255197,https://petharbor.com/get_image.asp?RES=Detail&LOCATION=KING&ID=A449513,Image Copyright HLP Inc. 2019,"Received on: 2018-07-28<p/> Description: Org Tabby Spayed Female Domestic Longhair Cat<p/> Age: 12 YEARS 9 MONTHS<p/> Current Location: In RASKC Foster Home <p/>Hi! My name is lily and I am available for adoption.<p/><p/>I was brought in by my previous owner on 7/28/18 because the other house cat did not like me.<p/><p/>My personality color is RED. I am a spirited cat with a fun-loving personality! I may be sensitive to handling, so I would do best in a home with a cat savvy family who knows when to give me some space.<p/><p/>I am an independent kitty who likes to do my own thing!<p/><p/>I like getting attention on my own terms. I can get overstimulated with petting, so please move carefully with me and keep an eye out for signs that I might need a break.<p/><p/>Because of my shy nature, I would do best in a calm, quiet home.<p/>Adoption Fee: $30.00<p/>",RED
K19-114977,A578672,Regional Animal Services of King County,FOUND,https://petharbor.com/PublicDetail.asp?searchtype=PUBFOUND&view=sysadm.v_animal&shelterlist='KING'&where=type&ID=1953742,In Public Home,,Dog,,Female,Dachshund - Wire-Haired,Black / Brown,01/19/2019 12:00:00 AM,Date Found,00 4TH AVE S,ALGONA,WA,98001,ALGONA,,,https://petharbor.com/get_image.asp?RES=Detail&LOCATION=PUBLIC&ID=1953742,Image Copyright HLP Inc. 2019,,
K17-102943,A538943,Regional Animal Services of King County,ADOPTABLE,https://kingcounty.gov/depts/regional-animal-services/about-us/overview.aspx,In RASKC Foster Home,Anastasia,Cat,9 YEARS 4 MONTHS,Spayed Female,Domestic Longhair,Black,09/17/2017 12:00:00 AM,Received on,21615 64TH AVE S,KENT,WA,98032,KENT,47.407788,-122.255197,https://petharbor.com/get_image.asp?RES=Detail&LOCATION=KING&ID=A538943,Image Copyright HLP Inc. 2019,"Received on: 2017-09-17<p/> Description: Black Spayed Female Domestic Longhair Cat<p/> Age: 9 YEARS 4 MONTHS<p/> Current Location: In RASKC Foster Home <p/>Hi! My name is Anastasia and I am available for adoption.<p/><p/>I was brought in by a good samaritan on September 17, 2017.<p/><p/>I am an independent kitty who likes to do my own thing! I like getting attention on my own terms. I can get overstimulated with petting, so please move carefully with me and keep an eye out for signs that I might need a break.<p/><p/>My caregivers have noticed that I do not seem to get along with other cats, so I may do best as the only cat in my new home.<p/><p/>My personality color is GREEN. I am an adaptable cat who loves to go with the flow! I am outgoing and carefree, and I just can't wait to find my forever home!<p/><p/>A veterinarian has diagnosed or tentatively diagnosed the above-described pet with the following condition(s):<p/><p/>1)   Renal disease.  Anastasia has been documented to have renal insufficiency characterized by increased renal values and the inability to concentrate urine.  She has increase thirst and increased urine production.  Renal disease is generally progressive and must be managed to maintain a good quality of life.  Your veterinarian may recommend additional testing, medications, prescription diets, or supplemental care as needed.<p/><p/>2)  Old fracture of left femoral head and left ilium.  Spondylosis in thoracolumbar area.  She has had some stiffness in the hind end.  These chronic changes can be managed with pain medication and joint supplements.  Treatment is focused on lifelong management of the disease, rather than a cure.  Treatment may include weight loss plans, daily medications, nutritional supplements or regular, moderate exercise.  Please follow up with your regular veterinarian.<p/><p/>3)  Radiographic evidence of bronchopulmonary disease/asthma.  No respiratoyr signs have been noted but she may need treatment in the future.<p/><p/>As a result of these conditions, your pet may need specialized care consisting of any or all of the below.  Please note this is not intended to be an exhaustive list.<p/><p/>- Special diet or prescription foods<p/>- Prescription or over-the-counter medicines<p/>- Special skin care or shampoos<p/>- Regular veterinarian visits, which may include blood tests or other monitoring<p/>- Possible surgery or other procedures as determined by your veterinarian<p/><p/>Adoption Fee: $30.00<p/>",
K19-114984,A578698,Regional Animal Services of King County,LOST,https://petharbor.com/PublicDetail.asp?searchtype=PUBFOUND&view=sysadm.v_animal&shelterlist='KING'&where=type&ID=1954019,LOST,Melody,Cat,,Female,Domestic Shorthair,Unknown,01/19/2019 12:00:00 AM,Date Lost,9100 159TH PL NE,REDMOND,WA,98052,REDMOND,,,https://petharbor.com/get_image.asp?RES=Detail&LOCATION=PUBLIC&ID=1954019,Image Copyright HLP Inc. 2019,,
K19-114983,A578697,Regional Animal Services of King County,FOUND,https://petharbor.com/PublicDetail.asp?searchtype=PUBFOUND&view=sysadm.v_animal&shelterlist='KING'&where=type&ID=1954003,In Public Home,,Dog,,,Norfolk Terrier,Brown,01/20/2019 12:00:00 AM,Date Found,12823 SOUTHEAST 280TH STREET,,,,JURISDICTION,,,https://petharbor.com/get_image.asp?RES=Detail&LOCATION=PUBLIC&ID=1954003,Image Copyright HLP Inc. 2019,,
K19-114985,A578725,Regional Animal Services of King County,FOUND,https://petharbor.com/PublicDetail.asp?searchtype=PUBFOUND&view=sysadm.v_animal&shelterlist='KING'&where=type&ID=1954149,In Public Home,,Dog,,Male,Australian Shepherd,Black / White,01/20/2019 12:00:00 AM,Date Found,NORTH SEATAC PARK,,,,JURISDICTION,,,https://petharbor.com/get_image.asp?RES=Detail&LOCATION=PUBLIC&ID=1954149,Image Copyright HLP Inc. 2019,,
K19-114986,A578727,Regional Animal Services of King County,LOST,https://petharbor.com/PublicDetail.asp?searchtype=PUBFOUND&view=sysadm.v_animal&shelterlist='KING'&where=type&ID=1954296,LOST,Thor,Dog,,Male,Alaskan Malamute,Unknown,01/21/2019 12:00:00 AM,Date Lost,7100 121ST AVE SE,NEWCASTLE,WA,98056,NEWCASTLE,,,https://petharbor.com/get_image.asp?RES=Detail&LOCATION=PUBLIC&ID=1954296,Image Copyright HLP Inc. 2019,,
K19-114989,A578730,Regional Animal Services of King County,LOST,https://petharbor.com/PublicDetail.asp?searchtype=PUBFOUND&view=sysadm.v_animal&shelterlist='KING'&where=type&ID=1954370,LOST,Roger,Cat,,Male,Domestic Longhair,Unknown,01/20/2019 12:00:00 AM,Date Lost,1642 S 240TH S,,,,JURISDICTION,,,https://petharbor.com/get_image.asp?RES=Detail&LOCATION=PUBLIC&ID=1954370,Image Copyright HLP Inc. 2019,,
K19-114995,A578778,Regional Animal Services of King County,LOST,https://petharbor.com/PublicDetail.asp?searchtype=PUBFOUND&view=sysadm.v_animal&shelterlist='KING'&where=type&ID=1954449,LOST,Rita,Dog,,Female,Miniature Pinscher,Unknown,01/18/2019 12:00:00 AM,Date Lost,,,WA,98032,JURISDICTION,,,https://petharbor.com/get_image.asp?RES=Detail&LOCATION=PUBLIC&ID=1954449,Image Copyright HLP Inc. 2019,,
K19-114996,A578785,Regional Animal Services of King County,FOUND,https://petharbor.com/PublicDetail.asp?searchtype=PUBFOUND&view=sysadm.v_animal&shelterlist='KING'&where=type&ID=1954502,In Public Home,,Dog,,,Labrador Retriever,Black,01/22/2019 12:00:00 AM,Date Found,900 QUARTZ DR SW,NORTH BEND,WA,98045,NORTH BEND,,,https://petharbor.com/get_image.asp?RES=Detail&LOCATION=PUBLIC&ID=1954502,Image Copyright HLP Inc. 2019,,
K19-115012,A578821,Regional Animal Services of King County,FOUND,https://petharbor.com/PublicDetail.asp?searchtype=PUBFOUND&view=sysadm.v_animal&shelterlist='KING'&where=type&ID=1954674,In Public Home,,Cat,,Male,Domestic Shorthair,Black / White,01/21/2019 12:00:00 AM,Date Found,156TH PLACE NE & NE 70TH CT,REDMOND,WA,98052,REDMOND,,,https://petharbor.com/get_image.asp?RES=Detail&LOCATION=PUBLIC&ID=1954674,Image Copyright HLP Inc. 2019,,
K18-114328,A576733,Regional Animal Services of King County,ADOPTABLE,https://kingcounty.gov/depts/regional-animal-services/about-us/overview.aspx,In RASKC Foster Home,Wiley,Cat,13 YEARS 9 MONTHS,Neutered Male,Domestic Shorthair,Orange / White,12/14/2018 12:00:00 AM,Received on,21615 64TH AVE S,KENT,WA,98032,KING COUNTY,47.407788,-122.255197,https://petharbor.com/get_image.asp?RES=Detail&LOCATION=KING&ID=A576733,Image Copyright HLP Inc. 2019,"Received on: 2018-12-14<p/> Description: Orange / White Neutered Male Domestic Shorthair Cat<p/> Age: 13 YEARS 9 MONTHS<p/> Current Location: In RASKC Foster Home <p/>Hi! My name is Wiley and I am available for adoption.<p/><p/>I was brought in by my previous owner on 12/14/18 because I was going to the bathroom outside of the litterbox.  My previous owners said that I do not seem to get along with other cats or dogs, so I may do best as the only cat in my new home. I am an active and friendly cat, and I love to play with string toys.  <p/><p/>My personality color is BLUE in this environment. I am a gentle and loving cat who likes to take things slow. I may get nervous in new situations, so I am looking for a family who understands that I might need some time to warm up. Once I get to know you, I will be a very devoted friend!<p/><p/><p/>Adoption Fee: $30.00<p/>",BLUE
K14-076951,A449967,Regional Animal Services of King County,ADOPTABLE,https://kingcounty.gov/depts/regional-animal-services/about-us/overview.aspx,In RASKC Foster Home,Penny,Cat,10 YEARS 3 MONTHS,Spayed Female,Domestic Shorthair,Calico,11/02/2014 12:00:00 AM,Received on,21615 64TH AVE S,KENT,WA,98032,KENT,47.407788,-122.255197,https://petharbor.com/get_image.asp?RES=Detail&LOCATION=KING&ID=A449967,Image Copyright HLP Inc. 2019,Received on: 2014-11-02<p/> Description: Calico Spayed Female Domestic Shorthair Cat<p/> Age: 10 YEARS 3 MONTHS<p/> Current Location: In RASKC Foster Home <p/><p/>Adoption Fee: $30.00<p/>,
K19-115013,A578822,Regional Animal Services of King County,LOST,https://petharbor.com/PublicDetail.asp?searchtype=PUBFOUND&view=sysadm.v_animal&shelterlist='KING'&where=type&ID=1954689,LOST,Little Bit,Dog,,Female,Yorkshire Terrier,Unknown,01/22/2019 12:00:00 AM,Date Lost,156TH,161ST MAPLE VALLE,,,JURISDICTION,,,https://petharbor.com/get_image.asp?RES=Detail&LOCATION=PUBLIC&ID=1954689,Image Copyright HLP Inc. 2019,,
K19-115027,A578852,Regional Animal Services of King County,LOST,https://petharbor.com/PublicDetail.asp?searchtype=PUBFOUND&view=sysadm.v_animal&shelterlist='KING'&where=type&ID=1954869,LOST,Blue Bear,Cat,,Female,Manx,Unknown,01/21/2019 12:00:00 AM,Date Lost,16060 INTERLAKE N.,,,,JURISDICTION,,,https://petharbor.com/get_image.asp?RES=Detail&LOCATION=PUBLIC&ID=1954869,Image Copyright HLP Inc. 2019,,
K19-115044,A578909,Regional Animal Services of King County,LOST,https://petharbor.com/PublicDetail.asp?searchtype=PUBFOUND&view=sysadm.v_animal&shelterlist='KING'&where=type&ID=1955153,LOST,Daisy,Dog,,Female,Australian Kelpie,Unknown,01/21/2019 12:00:00 AM,Date Lost,KAYAK LAKE RD AND HIGH ROCK RD,,,,JURISDICTION,,,https://petharbor.com/get_image.asp?RES=Detail&LOCATION=PUBLIC&ID=1955153,Image Copyright HLP Inc. 2019,,
K19-115053,A578919,Regional Animal Services of King County,LOST,https://petharbor.com/PublicDetail.asp?searchtype=PUBFOUND&view=sysadm.v_animal&shelterlist='KING'&where=type&ID=1955274,LOST,Charlie,Cat,,Male,Domestic Shorthair,Unknown,01/23/2019 12:00:00 AM,Date Lost,12900 SE 246TH ST,KENT,WA,98030,KENT,,,https://petharbor.com/get_image.asp?RES=Detail&LOCATION=PUBLIC&ID=1955274,Image Copyright HLP Inc. 2019,,
K19-115059,A578924,Regional Animal Services of King County,FOUND,https://petharbor.com/PublicDetail.asp?searchtype=PUBFOUND&view=sysadm.v_animal&shelterlist='KING'&where=type&ID=1955325,In Public Home,,Dog,,Female,Labrador Retriever,Black,01/24/2019 12:00:00 AM,Date Found,19600 42ND AVE NE,LAKE FOREST PARK,WA,98155,LAKE FOREST PAR,,,https://petharbor.com/get_image.asp?RES=Detail&LOCATION=PUBLIC&ID=1955325,Image Copyright HLP Inc. 2019,,
K19-115060,A578925,Regional Animal Services of King County,LOST,https://petharbor.com/PublicDetail.asp?searchtype=PUBFOUND&view=sysadm.v_animal&shelterlist='KING'&where=type&ID=1955368,LOST,Andre,Cat,,Male,Maine Coon,Unknown,01/19/2019 12:00:00 AM,Date Lost,42100 SE 171ST ST,NORTH BEND,WA,98045,KING COUNTY,,,https://petharbor.com/get_image.asp?RES=Detail&LOCATION=PUBLIC&ID=1955368,Image Copyright HLP Inc. 2019,,
K19-115073,A578964,Regional Animal Services of King County,LOST,https://petharbor.com/PublicDetail.asp?searchtype=PUBFOUND&view=sysadm.v_animal&shelterlist='KING'&where=type&ID=1955450,LOST,George,Dog,,Male,American Pit Bull Terrier,Unknown,01/25/2019 12:00:00 AM,Date Lost,42ND AVE S AND STAR LAKE ROAD,,,,JURISDICTION,,,https://petharbor.com/get_image.asp?RES=Detail&LOCATION=PUBLIC&ID=1955450,Image Copyright HLP Inc. 2019,,
K19-115082,A578985,Regional Animal Services of King County,FOUND,https://kingcounty.gov/depts/regional-animal-services/about-us/overview.aspx,,,Dead Cat,NO AGE,Unaltered,Domestic Shorthair,Buff,01/25/2019 12:00:00 AM,Received on,2400 S 260TH ST,KENT,WA,98032,KENT,,,,Image Copyright HLP Inc. 2019,"Received on: 2019-01-25<p/> Found Near: 2400 S 260TH ST, KENT WA 98032<p/> Description: Buff Unaltered Domestic Shorthair Cat<p/> Age: NO AGE<p/>",
K18-109705,A561461,Regional Animal Services of King County,ADOPTABLE,https://kingcounty.gov/depts/regional-animal-services/about-us/overview.aspx,In RASKC Foster Home,Baby Girl,Cat,14 YEARS 7 MONTHS,Spayed Female,Domestic Shorthair,Seal Pt,06/26/2018 12:00:00 AM,Received on,21615 64TH AVE S,KENT,WA,98032,COVINGTON,47.407788,-122.255197,https://petharbor.com/get_image.asp?RES=Detail&LOCATION=KING&ID=A561461,Image Copyright HLP Inc. 2019,"Received on: 2018-06-26<p/> Description: Seal Pt Spayed Female Domestic Shorthair Cat<p/> Age: 14 YEARS 7 MONTHS<p/> Current Location: In RASKC Foster Home <p/>Hi! My name is Baby Girl and I am available for adoption.<p/><p/>I was brought in by my previous owner on 6/26/18 because they couldnt take care of me anymore. My previous owner described me as friendly, active, playful and vocal.<p/><p/>I do love to talk! I would love to tell you all about how my day is going!<p/>I am an affectionate lovebug who would be thrilled to cuddle up with you at home!<p/><p/>My personality color is GREEN. I am an adaptable cat who loves to go with the flow! I am outgoing and carefree, and I just can't wait to find my forever home!<p/><p/><p/>Adoption Fee: $30.00<p/>",GREEN
K19-115058,A578923,Regional Animal Services of King County,LOST,https://petharbor.com/PublicDetail.asp?searchtype=PUBFOUND&view=sysadm.v_animal&shelterlist='KING'&where=type&ID=1955322,LOST,Charlie,Cat,,Male,Domestic Shorthair,Unknown,01/23/2019 12:00:00 AM,Date Lost,12900 SE 246TH ST,KENT,WA,98030,KENT,,,https://petharbor.com/get_image.asp?RES=Detail&LOCATION=PUBLIC&ID=1955322,Image Copyright HLP Inc. 2019,,
K19-114946,A572304,Regional Animal Services of King County,ADOPTABLE,https://petharbor.com/pet.asp?uaid=KING.A572304,"King County Pet Adoption Center 21615 64TH AVE S KENT, WA 98032",May,Cat,7 YEARS 3 MONTHS,Spayed Female,Domestic Shorthair,Gray Tabby / White,01/18/2019 12:00:00 AM,Received on,,,,,,,,https://petharbor.com/get_image.asp?RES=Detail&LOCATION=KING&ID=A572304,Image Copyright HLP Inc. 2019,"Received on: 2019-01-18<p/> Description: Gray Tabby / White<p/>  Spayed Female Domestic Shorthair Cat<p/> Age: 7 YEARS 3 MONTHS<p/> Current Location: King County Pet Adoption Center 21615 64TH AVE S KENT, WA 98032<p/>Hi! My name is May and I am available for adoption. I was brought in by my previous owner on 1/18/19. <p/><p/>My personality color is RED. I am a spirited cat with a fun-loving personality! I may be sensitive to handling, so I would do best in a home with a cat savvy family who knows when to give me some space. I like getting attention on my own terms. I can get overstimulated with petting, so please move carefully with me and keep an eye out for signs that I might need a break.<p/><p/>A veterinarian has diagnosed or tentatively diagnosed the above-described pet with the following condition(s):<p/><p/>1)     This animal has been diagnosed with hyperthyroidism; excess production of thyroid hormone.  Hyperthyroidism can cause weight loss, vocalization, increased urine production and heart disease.  This condition is being managed with daily medication.  Other treatment options may be available, including radioactive iodine treatment or prescription diet.  Periodic blood testing to monitor thyroid levels is needed.  Please follow up with you regular veterinarian to create a treatment plan.  An educational handout is provided.<p/><p/>2)   Renal disease.  This pet has been documented to have early renal insufficiency characterized by increased renal values.  This condition may cause increase thirst and increased urine production.  Renal disease is generally progressive and must be managed to maintain a good quality of life.  Your veterinarian may recommend additional testing, medications, prescription diets, or supplemental care as needed.<p/><p/>As a result of these conditions, your pet may need specialized care consisting of any or all of the below.  Please note this is not intended to be an exhaustive list.<p/><p/>- Special diet or prescription foods<p/>- Prescription or over-the-counter medicines<p/>- Special skin care or shampoos<p/>- Regular veterinarian visits, which may include blood tests or other monitoring<p/>- Possible surgery or other procedures as determined by your veterinarian<p/><p/> Adoption Fee: $30.00<p/>",RED
K19-115048,A574929,Regional Animal Services of King County,ADOPTABLE,https://petharbor.com/pet.asp?uaid=KING.A574929,"King County Pet Adoption Center 21615 64TH AVE S KENT, WA 98032",Georgie,Cat,8 YEARS 2 MONTHS,Spayed Female,Domestic Shorthair,Brn Tabby / White,01/24/2019 12:00:00 AM,Received on,,,,,,,,https://petharbor.com/get_image.asp?RES=Detail&LOCATION=KING&ID=A574929,Image Copyright HLP Inc. 2019,"Received on: 2019-01-24<p/> Description: Brn Tabby / White<p/>  Spayed Female Domestic Shorthair Cat<p/> Age: 8 YEARS 2 MONTHS<p/> Current Location: King County Pet Adoption Center 21615 64TH AVE S KENT, WA 98032<p/>Hi! My name is Georgie and I am available for adoption.<p/><p/>I was brought in by a good samaritan on 11/17/18.<p/><p/>My personality color is GREEN. I am an adaptable cat who loves to go with the flow! I am outgoing and carefree, and I just can't wait to find my forever home!<p/><p/> Adoption Fee: $30.00<p/>",GREEN
K19-115056,A578921,Regional Animal Services of King County,FOUND,https://petharbor.com/pet.asp?uaid=KING.A578921,"King County Pet Adoption Center 21615 64TH AVE S KENT, WA 98032",Mason,Cat,NO AGE,Male,Siamese / Mix,Seal Pt,01/24/2019 12:00:00 AM,Received on,4200 S 172ND ST,SEATAC,WA,98188,SEATAC,,,https://petharbor.com/get_image.asp?RES=Detail&LOCATION=KING&ID=A578921,Image Copyright HLP Inc. 2019,"Received on: 2019-01-24<p/> Found Near: 4200 S 172ND ST, SEATAC WA 98188<p/> Description: Seal Pt Male Siamese / Mix Cat<p/> Age: NO AGE<p/> Current Location: King County Pet Adoption Center 21615 64TH AVE S KENT, WA 98032<p/>",
K19-115075,A578967,Regional Animal Services of King County,FOUND,https://kingcounty.gov/depts/regional-animal-services/about-us/overview.aspx,,Rocky,Dead Dog,NO AGE,Neutered Male,Terrier / Mix,White / Brown,01/25/2019 12:00:00 AM,Received on,16400 CEDAR GROVE RD SE,ISSAQUAH,WA,98027,KING COUNTY,47.454875,-122.028452,,Image Copyright HLP Inc. 2019,"Received on: 2019-01-25<p/> Found Near: 16400 CEDAR GROVE RD SE, ISSAQUAH WA 98027<p/> Description: White / Brown Neutered Male Terrier / Mix Dog<p/> Age: NO AGE<p/>",
K18-111651,A566749,Regional Animal Services of King County,ADOPTABLE,https://kingcounty.gov/depts/regional-animal-services/about-us/overview.aspx,In RASKC Foster Home,Rosie,Cat,13 YEARS 5 MONTHS,Female,Domestic Shorthair,Calico / Tortie,08/27/2018 12:00:00 AM,Received on,21615 64TH AVE S,KENT,WA,98032,KENT,47.407788,-122.255197,https://petharbor.com/get_image.asp?RES=Detail&LOCATION=KING&ID=A566749,Image Copyright HLP Inc. 2019,"Received on: 2018-08-27<p/> Description: Calico / Tortie Female Domestic Shorthair Cat<p/> Age: 13 YEARS 5 MONTHS<p/> Current Location: In RASKC Foster Home <p/>Hi! My name is Rosie and I am available for adoption.<p/><p/>I was brought in by a good samaritan on 8/27/18.<p/><p/>My personality color is GREEN. I am an adaptable cat who loves to go with the flow! I am outgoing and carefree, and I just can't wait to find my forever home!<p/><p/>I am an affectionate lovebug who would be thrilled to cuddle up with you at home!<p/><p/><p/>Adoption Fee: $30.0<p/>",GREEN
K19-115095,A578996,Regional Animal Services of King County,LOST,https://petharbor.com/PublicDetail.asp?searchtype=PUBFOUND&view=sysadm.v_animal&shelterlist='KING'&where=type&ID=1955745,LOST,Prince,Cat,,Male,Domestic Shorthair,Unknown,01/25/2019 12:00:00 AM,Date Lost,SO 244TH ST AND PACIFIC HWY SO,,,,JURISDICTION,,,https://petharbor.com/get_image.asp?RES=Detail&LOCATION=PUBLIC&ID=1955745,Image Copyright HLP Inc. 2019,,
K19-115112,A579032,Regional Animal Services of King County,LOST,https://petharbor.com/PublicDetail.asp?searchtype=PUBFOUND&view=sysadm.v_animal&shelterlist='KING'&where=type&ID=1956094,LOST,Caesar,Dog,,Male,Rough Collie,Unknown,01/25/2019 12:00:00 AM,Date Lost,23600 CARTER RD,BOTHELL,WA,98021,SNOHOMISH COUNT,,,https://petharbor.com/get_image.asp?RES=Detail&LOCATION=PUBLIC&ID=1956094,Image Copyright HLP Inc. 2019,,
K19-115115,A579035,Regional Animal Services of King County,LOST,https://petharbor.com/PublicDetail.asp?searchtype=PUBFOUND&view=sysadm.v_animal&shelterlist='KING'&where=type&ID=1956135,LOST,Athena,Dog,,Female,Pit Bull,Unknown,01/25/2019 12:00:00 AM,Date Lost,224TH AND 84TH AVE S,,,,JURISDICTION,,,https://petharbor.com/get_image.asp?RES=Detail&LOCATION=PUBLIC&ID=1956135,Image Copyright HLP Inc. 2019,,
K19-114894,A055205,Regional Animal Services of King County,ADOPTABLE,https://petharbor.com/pet.asp?uaid=KING.A055205,"King County Pet Adoption Center 21615 64TH AVE S KENT, WA 98032",Keyla,Dog,8 YEARS 4 MONTHS,Spayed Female,Pit Bull,Black / White,01/16/2019 12:00:00 AM,Received on,,,,,,,,https://petharbor.com/get_image.asp?RES=Detail&LOCATION=KING&ID=A055205,Image Copyright HLP Inc. 2019,"Received on: 2019-01-16<p/> Description: Black / White<p/>  Spayed Female Pit Bull Dog<p/> Age: 8 YEARS 4 MONTHS<p/> Current Location: King County Pet Adoption Center 21615 64TH AVE S KENT, WA 98032<p/>Hi! My name is Keyla and I am available for adoption.<p/><p/>I was brought in by my previous owner on January 16, 2019 because I have seperation anxiety. Because of that, I would do best in a home with someone who is home often or maybe could even take me with you to work!<p/><p/>I am an affectionate lovebug who would be thrilled to cuddle up with you at home! Despite my larger size, I still think of myself as a lapdog and will gladly curl up in your lap to take a nap if you let me. If you're looking for a snuggler then you found her!<p/><p/>I am also very good on leash and enjoy leisurely strolls with my people.<p/><p/>I arrived to the shelter with another large dog, but based on what my caregivers have observed, I would be happiest as the only pet in my new home. I want to be spoiled and be your only fur baby!<p/><p/>My personality color is GREEN. I am an adaptable dog who loves to go with the flow! I am outgoing and carefree, and I just can't wait to find my forever home!<p/> Adoption Fee: $100.00<p/>",GREEN
K19-115125,A517074,Regional Animal Services of King County,FOUND,https://kingcounty.gov/depts/regional-animal-services/about-us/overview.aspx,,Barney,Dead Dog,12 YEARS,Neutered Male,Beagle,Tricolor,01/28/2019 12:00:00 AM,Received on,23400 262ND AVE SE,MAPLE VALLEY,WA,98038,KING COUNTY,,,,Image Copyright HLP Inc. 2019,"Received on: 2019-01-28<p/> Found Near: 23400 262ND AVE SE, MAPLE VALLEY WA 98038<p/> Description: Tricolor Neutered Male Beagle Dog<p/> Age: 12 YEARS<p/>",
K19-115116,A579036,Regional Animal Services of King County,LOST,https://petharbor.com/PublicDetail.asp?searchtype=PUBFOUND&view=sysadm.v_animal&shelterlist='KING'&where=type&ID=1956168,LOST,Kepler,Dog,,Male,Rottweiler,Unknown,01/27/2019 12:00:00 AM,Date Lost,GRAND RIDGE PARK - WATER TOWER LOOP,,,,JURISDICTION,,,https://petharbor.com/get_image.asp?RES=Detail&LOCATION=PUBLIC&ID=1956168,Image Copyright HLP Inc. 2019,,
K19-115136,A579118,Regional Animal Services of King County,LOST,https://petharbor.com/PublicDetail.asp?searchtype=PUBFOUND&view=sysadm.v_animal&shelterlist='KING'&where=type&ID=1956579,LOST,Barney,Cat,,Male,Domestic Shorthair,Unknown,01/28/2019 12:00:00 AM,Date Lost,,,,64,JURISDICTION,,,https://petharbor.com/get_image.asp?RES=Detail&LOCATION=PUBLIC&ID=1956579,Image Copyright HLP Inc. 2019,,
K19-115140,A579122,Regional Animal Services of King County,LOST,https://petharbor.com/PublicDetail.asp?searchtype=PUBFOUND&view=sysadm.v_animal&shelterlist='KING'&where=type&ID=1956620,LOST,Gizmo,Cat,,Male,Himalayan,Unknown,01/27/2019 12:00:00 AM,Date Lost,15800 14TH AVE NE,SHORELINE,WA,98155,SHORELINE,,,https://petharbor.com/get_image.asp?RES=Detail&LOCATION=PUBLIC&ID=1956620,Image Copyright HLP Inc. 2019,,
K19-115142,A579128,Regional Animal Services of King County,FOUND,https://kingcounty.gov/depts/regional-animal-services/about-us/overview.aspx,,,Dead Cat,NO AGE,Unaltered,Domestic Mediumhair,Black,01/29/2019 12:00:00 AM,Received on,10600 SE KENT KANGLEY RD,KENT,WA,98030,KENT,,,,Image Copyright HLP Inc. 2019,"Received on: 2019-01-29<p/> Found Near: 10600 SE KENT KANGLEY RD, KENT WA 98030<p/> Description: Black Unaltered Domestic Mediumhair Cat<p/> Age: NO AGE<p/>",
K19-115141,A579123,Regional Animal Services of King County,LOST,https://petharbor.com/PublicDetail.asp?searchtype=PUBFOUND&view=sysadm.v_animal&shelterlist='KING'&where=type&ID=1956628,LOST,Googles,Cat,,Male,Domestic Shorthair,Unknown,01/28/2019 12:00:00 AM,Date Lost,108TH AVE S.E,,,,JURISDICTION,,,https://petharbor.com/get_image.asp?RES=Detail&LOCATION=PUBLIC&ID=1956628,Image Copyright HLP Inc. 2019,,
K19-115156,A579149,Regional Animal Services of King County,LOST,https://petharbor.com/PublicDetail.asp?searchtype=PUBFOUND&view=sysadm.v_animal&shelterlist='KING'&where=type&ID=1956881,LOST,Johnny,Cat,,Male,Norwegian Forest Cat,Unknown,01/07/2019 12:00:00 AM,Date Lost,TALL FIR ESTATES,130TH AND NE 8T,,,JURISDICTION,,,https://petharbor.com/get_image.asp?RES=Detail&LOCATION=PUBLIC&ID=1956881,Image Copyright HLP Inc. 2019,,
K19-115157,A579150,Regional Animal Services of King County,LOST,https://petharbor.com/PublicDetail.asp?searchtype=PUBFOUND&view=sysadm.v_animal&shelterlist='KING'&where=type&ID=1956893,LOST,Treater,Dog,,Male,Labrador Retriever,Unknown,01/29/2019 12:00:00 AM,Date Lost,8600 309TH PL SE,ISSAQUAH,WA,98027,KING COUNTY,,,https://petharbor.com/get_image.asp?RES=Detail&LOCATION=PUBLIC&ID=1956893,Image Copyright HLP Inc. 2019,,
K19-115169,A579196,Regional Animal Services of King County,FOUND,https://petharbor.com/PublicDetail.asp?searchtype=PUBFOUND&view=sysadm.v_animal&shelterlist='KING'&where=type&ID=1957112,In Public Home,,Cat,,Female,Domestic Mediumhair,Black / Brown,01/20/2019 12:00:00 AM,Date Found,10700 SE 260TH ST,KENT,WA,98030,KENT,47.369116,-122.199405,https://petharbor.com/get_image.asp?RES=Detail&LOCATION=PUBLIC&ID=1957112,Image Copyright HLP Inc. 2019,,
K18-114609,A577634,Regional Animal Services of King County,FOUND,https://petharbor.com/pet.asp?uaid=KING.A577634,Meowtropolitan,Aaron,Cat,4 YEARS 1 MONTH,Neutered Male,Domestic Shorthair,White / Black,12/31/2018 12:00:00 AM,Received on,40300 302ND AVE SE,ENUMCLAW,WA,98022,KING COUNTY,,,https://petharbor.com/get_image.asp?RES=Detail&LOCATION=KING&ID=A577634,Image Copyright HLP Inc. 2019,"Received on: 2018-12-31<p/> Found Near: 40300 302ND AVE SE, ENUMCLAW WA 98022<p/> Description: White / Black Neutered Male Domestic Shorthair Cat<p/> Age: 4 YEARS 1 MONTH<p/> Current Location: Meowtropolitan<p/>",GREEN
K19-115175,A579200,Regional Animal Services of King County,LOST,https://petharbor.com/PublicDetail.asp?searchtype=PUBFOUND&view=sysadm.v_animal&shelterlist='KING'&where=type&ID=1957190,LOST,Solo Vino,Cat,,Male,Domestic Shorthair,Unknown,01/24/2019 12:00:00 AM,Date Lost,APT. 102,,,,JURISDICTION,,,https://petharbor.com/get_image.asp?RES=Detail&LOCATION=PUBLIC&ID=1957190,Image Copyright HLP Inc. 2019,,
K19-115177,A579216,Regional Animal Services of King County,FOUND,https://kingcounty.gov/depts/regional-animal-services/about-us/overview.aspx,,,Dead Cat,1 YEAR,Male,Domestic Shorthair,Black,01/31/2019 12:00:00 AM,Received on,21600 64TH AVE S,KENT,WA,98032,KENT,,,,Image Copyright HLP Inc. 2019,"Received on: 2019-01-31<p/> Found Near: 21600 64TH AVE S, KENT WA 98032<p/> Description: Black Male Domestic Shorthair Cat<p/> Age: 1 YEAR<p/>",
K19-115176,A579215,Regional Animal Services of King County,LOST,https://petharbor.com/PublicDetail.asp?searchtype=PUBFOUND&view=sysadm.v_animal&shelterlist='KING'&where=type&ID=1957209,LOST,Scott,Dog,,Male,Boston Terrier,Unknown,01/25/2019 12:00:00 AM,Date Lost,"LAKEVIEW AVE LAKEWOOD , WA",,,,JURISDICTION,,,https://petharbor.com/get_image.asp?RES=Detail&LOCATION=PUBLIC&ID=1957209,Image Copyright HLP Inc. 2019,,
K19-115114,A579034,Regional Animal Services of King County,FOUND,https://petharbor.com/pet.asp?uaid=KING.A579034,"King County Pet Adoption Center 21615 64TH AVE S KENT, WA 98032",Mccoy,Cat,2 YEARS,Neutered Male,Domestic Mediumhair,Black,01/27/2019 12:00:00 AM,Received on,30000 42ND PL S,AUBURN,WA,98001,KING COUNTY,,,https://petharbor.com/get_image.asp?RES=Detail&LOCATION=KING&ID=A579034,Image Copyright HLP Inc. 2019,"Received on: 2019-01-27<p/> Found Near: 30000 42ND PL S, AUBURN WA 98001<p/> Description: Black Neutered Male Domestic Mediumhair Cat<p/> Age: 2 YEARS<p/> Current Location: King County Pet Adoption Center 21615 64TH AVE S KENT, WA 98032<p/>",
K19-115102,A402864,Regional Animal Services of King County,ADOPTABLE,https://petharbor.com/pet.asp?uaid=KING.A402864,"King County Pet Adoption Center 21615 64TH AVE S KENT, WA 98032",Gon So,Dog,8 YEARS 3 MONTHS,Neutered Male,Australian Shepherd / Mix,Black / Brown,01/26/2019 12:00:00 AM,Received on,,,,,,,,https://petharbor.com/get_image.asp?RES=Detail&LOCATION=KING&ID=A402864,Image Copyright HLP Inc. 2019,"Received on: 2019-01-26<p/> Description: Black / Brown<p/>  Neutered Male Australian Shepherd / Mix Dog<p/> Age: 8 YEARS 3 MONTHS<p/> Current Location: King County Pet Adoption Center 21615 64TH AVE S KENT, WA 98032<p/>Hi! My name is Gon So and I am available for adoption. I was surrendered to the shelter on 12/8/18.<p/><p/>My personality color is GREEN. I am an adaptable dog who loves to go with the flow! I am outgoing and carefree, and I just can't wait to find my forever home!<p/><p/>My caregivers noticed that I do not get along with cats.  I need to go to home without cats or small animals.  <p/><p/>I am a very smart dog! I have shown my caregivers that I already know how to sit, come, down and shake.<p/><p/>I am an affectionate lovebug who would be thrilled to cuddle up with you at home!<p/><p/>My caregivers have noticed that I seem to do well with other dogs. I would like to meet dogs in a new home, I would do best with a slow introduction.  <p/><p/><p/> Adoption Fee: $200.00<p/>",GREEN
K19-115153,A579148,Regional Animal Services of King County,FOUND,https://petharbor.com/pet.asp?uaid=KING.A579148,"King County Pet Adoption Center 21615 64TH AVE S KENT, WA 98032",Kirk,Cat,7 YEARS,Neutered Male,Domestic Longhair,Flame Pt,01/29/2019 12:00:00 AM,Received on,20000 200TH AVE SE,MAPLE VALLEY,WA,98038,KING COUNTY,,,https://petharbor.com/get_image.asp?RES=Detail&LOCATION=KING&ID=A579148,Image Copyright HLP Inc. 2019,"Received on: 2019-01-29<p/> Found Near: 20000 200TH AVE SE, MAPLE VALLEY WA 98038<p/> Description: Flame Pt Neutered Male Domestic Longhair Cat<p/> Age: 7 YEARS<p/> Current Location: King County Pet Adoption Center 21615 64TH AVE S KENT, WA 98032<p/>",
K19-115178,A579217,Regional Animal Services of King County,LOST,https://petharbor.com/PublicDetail.asp?searchtype=PUBFOUND&view=sysadm.v_animal&shelterlist='KING'&where=type&ID=1957293,LOST,Izzy,Cat,,Female,Domestic Mediumhair,Unknown,01/23/2019 12:00:00 AM,Date Lost,1400 14TH PL NE,ISSAQUAH,WA,98029,ISSAQUAH,,,https://petharbor.com/get_image.asp?RES=Detail&LOCATION=PUBLIC&ID=1957293,Image Copyright HLP Inc. 2019,,
K19-115148,A579142,Regional Animal Services of King County,FOUND,https://petharbor.com/pet.asp?uaid=KING.A579142,"King County Pet Adoption Center 21615 64TH AVE S KENT, WA 98032",Bernard,Cat,5 YEARS,Neutered Male,Domestic Shorthair,Gray,01/29/2019 12:00:00 AM,Received on,10500 SE 235TH ST,KENT,WA,98031,KENT,47.391047,-122.20122,https://petharbor.com/get_image.asp?RES=Detail&LOCATION=KING&ID=A579142,Image Copyright HLP Inc. 2019,"Received on: 2019-01-29<p/> Found Near: 10500 SE 235TH ST, KENT WA 98031<p/> Description: Gray Neutered Male Domestic Shorthair Cat<p/> Age: 5 YEARS<p/> Current Location: King County Pet Adoption Center 21615 64TH AVE S KENT, WA 98032<p/>",
K15-081328,A467465,Regional Animal Services of King County,ADOPTABLE,https://kingcounty.gov/depts/regional-animal-services/about-us/overview.aspx,In RASKC Foster Home,Petal,Cat,13 YEARS 7 MONTHS,Spayed Female,Domestic Longhair,Black / White,06/19/2015 12:00:00 AM,Received on,21615 64TH AVE S,KENT,WA,98032,MAPLE VALLEY,47.407788,-122.255197,https://petharbor.com/get_image.asp?RES=Detail&LOCATION=KING&ID=A467465,Image Copyright HLP Inc. 2019,Received on: 2015-06-19<p/> Description: Black / White Spayed Female Domestic Longhair Cat<p/> Age: 13 YEARS 7 MONTHS<p/> Current Location: In RASKC Foster Home <p/><p/>Adoption Fee: An Adoption Fee has not been set. Please inquire with the shelter.<p/>,BLUE
K19-115181,A579224,Regional Animal Services of King County,FOUND,https://petharbor.com/PublicDetail.asp?searchtype=PUBFOUND&view=sysadm.v_animal&shelterlist='KING'&where=type&ID=1957360,In Public Home,,Cat,,Female,Domestic Shorthair,Black / White,01/30/2019 12:00:00 AM,Date Found,98TH AND S 246TH PL,,,,JURISDICTION,,,https://petharbor.com/get_image.asp?RES=Detail&LOCATION=PUBLIC&ID=1957360,Image Copyright HLP Inc. 2019,,
K19-115187,A579243,Regional Animal Services of King County,FOUND,https://kingcounty.gov/depts/regional-animal-services/about-us/overview.aspx,,,Dead Dog,NO AGE,Female,Pit Bull,Gray,02/01/2019 12:00:00 AM,Received on,12600 SE 208TH ST,KENT,WA,98031,KENT,,,,Image Copyright HLP Inc. 2019,"Received on: 2019-02-01<p/> Found Near: 12600 SE 208TH ST, KENT WA 98031<p/> Description: Gray Female Pit Bull Dog<p/> Age: NO AGE<p/>",
K19-115186,A579242,Regional Animal Services of King County,FOUND,https://kingcounty.gov/depts/regional-animal-services/about-us/overview.aspx,,,Dead Dog,NO AGE,Female,Pit Bull,Black / White,02/01/2019 12:00:00 AM,Received on,12600 SE 208TH ST,KENT,WA,98031,KENT,,,,Image Copyright HLP Inc. 2019,"Received on: 2019-02-01<p/> Found Near: 12600 SE 208TH ST, KENT WA 98031<p/> Description: Black / White Female Pit Bull Dog<p/> Age: NO AGE<p/>",
K19-115185,A579241,Regional Animal Services of King County,LOST,https://petharbor.com/PublicDetail.asp?searchtype=PUBFOUND&view=sysadm.v_animal&shelterlist='KING'&where=type&ID=1957503,LOST,Scooter,Cat,,Male,Domestic Longhair,Unknown,01/29/2019 12:00:00 AM,Date Lost,PACIFIC STREET & 5TH AVE,BLACK DIAMOND,WA,98010,BLACK DIAMOND,,,https://petharbor.com/get_image.asp?RES=Detail&LOCATION=PUBLIC&ID=1957503,Image Copyright HLP Inc. 2019,,
K19-115098,A578999,Regional Animal Services of King County,FOUND,https://petharbor.com/pet.asp?uaid=KING.A578999,"King County Pet Adoption Center 21615 64TH AVE S KENT, WA 98032",Michael,Rabbit Sh,6 MONTHS,Neutered Male,Rabbit Sh,Gray,01/26/2019 12:00:00 AM,Received on,32400 5TH AVE,BLACK DIAMOND,WA,98010,BLACK DIAMOND,,,https://petharbor.com/get_image.asp?RES=Detail&LOCATION=KING&ID=A578999,Image Copyright HLP Inc. 2019,"Received on: 2019-01-26<p/> Found Near: 32400 5TH AVE, BLACK DIAMOND WA 98010<p/> Description: Gray Neutered Male Rabbit Sh Rabbit Sh<p/> Age: 6 MONTHS<p/> Current Location: King County Pet Adoption Center 21615 64TH AVE S KENT, WA 98032<p/>",
K19-115191,A579271,Regional Animal Services of King County,LOST,https://petharbor.com/PublicDetail.asp?searchtype=PUBFOUND&view=sysadm.v_animal&shelterlist='KING'&where=type&ID=1957618,LOST,Tootsie,Cat,,Male,Domestic Shorthair,Unknown,01/31/2019 12:00:00 AM,Date Lost,2300 N 60TH ST,SEATTLE,WA,98103,SEATTLE,,,https://petharbor.com/get_image.asp?RES=Detail&LOCATION=PUBLIC&ID=1957618,Image Copyright HLP Inc. 2019,,
K19-115195,A579280,Regional Animal Services of King County,LOST,https://petharbor.com/PublicDetail.asp?searchtype=PUBFOUND&view=sysadm.v_animal&shelterlist='KING'&where=type&ID=1957692,LOST,Denali,Dog,,Female,Belgian Malinois,Unknown,02/01/2019 12:00:00 AM,Date Lost,MYRTLE AND HOLLY PARK DRIVE,,,,JURISDICTION,,,https://petharbor.com/get_image.asp?RES=Detail&LOCATION=PUBLIC&ID=1957692,Image Copyright HLP Inc. 2019,,
K19-114628,A577667,Regional Animal Services of King County,FOUND,https://petharbor.com/pet.asp?uaid=KING.A577667,Meowtropolitan,Eugene,Cat,2 YEARS 1 MONTH,Neutered Male,Domestic Shorthair,Org Tabby / White,01/02/2019 12:00:00 AM,Received on,700 GRIFFIN AVE,ENUMCLAW,WA,98022,ENUMCLAW,,,https://petharbor.com/get_image.asp?RES=Detail&LOCATION=KING&ID=A577667,Image Copyright HLP Inc. 2019,"Received on: 2019-01-02<p/> Found Near: 700 GRIFFIN AVE, ENUMCLAW WA 98022<p/> Description: Org Tabby / White Neutered Male Domestic Shorthair Cat<p/> Age: 2 YEARS 1 MONTH<p/> Current Location: Meowtropolitan<p/>",BLUE
K18-111806,A567224,Regional Animal Services of King County,FOUND,https://petharbor.com/pet.asp?uaid=KING.A567224,Neko,Snickers,Cat,3 YEARS 5 MONTHS,Neutered Male,Domestic Shorthair,Brn Tabby,09/02/2018 12:00:00 AM,Received on,10800 SE 222ND PL,KENT,WA,98031,KENT,,,https://petharbor.com/get_image.asp?RES=Detail&LOCATION=KING&ID=A567224,Image Copyright HLP Inc. 2019,"Received on: 2018-09-02<p/> Found Near: 10800 SE 222ND PL, KENT WA 98031<p/> Description: Brn Tabby Neutered Male Domestic Shorthair Cat<p/> Age: 3 YEARS 5 MONTHS<p/> Current Location: Neko<p/>",
K18-110899,A564655,Regional Animal Services of King County,ADOPTABLE,https://kingcounty.gov/depts/regional-animal-services/about-us/overview.aspx,In RASKC Foster Home,Checkers,Cat,14 YEARS 6 MONTHS,Spayed Female,Domestic Shorthair,Black / White,08/02/2018 12:00:00 AM,Received on,21615 64TH AVE S,KENT,WA,98032,KING COUNTY,47.407788,-122.255197,https://petharbor.com/get_image.asp?RES=Detail&LOCATION=KING&ID=A564655,Image Copyright HLP Inc. 2019,"Received on: 2018-08-02<p/> Description: Black / White Spayed Female Domestic Shorthair Cat<p/> Age: 14 YEARS 6 MONTHS<p/> Current Location: In RASKC Foster Home <p/>Hi! My name is Checkers and I am available for adoption.<p/><p/>I was brought in by my previous owner on August 2nd, 2018 because they were moving and could not keep me. My previous owner described me as friendly and sweet. They also said that I like to hang out in windows and watch birds, lay on your lap and that I'm not a big fan of being picked up. <p/><p/>My personality color is red.  I enjoy getting pets on the head most and I like sitting on your lap after I get to know you!  <p/><p/>My caregivers have noticed I do not like other cats.  I prefer to be the only princess in the house!<p/><p/>Adoption Fee: $30.00<p/>",RED
K19-114637,A577743,Regional Animal Services of King County,FOUND,https://petharbor.com/pet.asp?uaid=KING.A577743,"Covington Petco 27111 167TH PL SE COVINGTON, WA 98042",Maya,Cat,2 YEARS 1 MONTH,Spayed Female,Domestic Mediumhair,Tortie,01/02/2019 12:00:00 AM,Received on,1000 CENTRAL AVE N,KENT,WA,98032,KENT,,,https://petharbor.com/get_image.asp?RES=Detail&LOCATION=KING&ID=A577743,Image Copyright HLP Inc. 2019,"Received on: 2019-01-02<p/> Found Near: 1000 CENTRAL AVE N, KENT WA 98032<p/> Description: Tortie Spayed Female Domestic Mediumhair Cat<p/> Age: 2 YEARS 1 MONTH<p/> Current Location: Covington Petco 27111 167TH PL SE COVINGTON, WA 98042<p/>",GREEN
K19-114638,A577744,Regional Animal Services of King County,FOUND,https://petharbor.com/pet.asp?uaid=KING.A577744,"Covington Petco 27111 167TH PL SE COVINGTON, WA 98042",Taiga,Cat,2 YEARS 1 MONTH,Neutered Male,Domestic Shorthair,Brn Tabby,01/02/2019 12:00:00 AM,Received on,1000 CENTRAL AVE N,KENT,WA,98032,KENT,,,https://petharbor.com/get_image.asp?RES=Detail&LOCATION=KING&ID=A577744,Image Copyright HLP Inc. 2019,"Received on: 2019-01-02<p/> Found Near: 1000 CENTRAL AVE N, KENT WA 98032<p/> Description: Brn Tabby Neutered Male Domestic Shorthair Cat<p/> Age: 2 YEARS 1 MONTH<p/> Current Location: Covington Petco 27111 167TH PL SE COVINGTON, WA 98042<p/>",GREEN
K19-115209,A579307,Regional Animal Services of King County,LOST,https://petharbor.com/PublicDetail.asp?searchtype=PUBFOUND&view=sysadm.v_animal&shelterlist='KING'&where=type&ID=1957934,LOST,Oolong/cilla,Cat,,Female,Domestic Shorthair,Unknown,02/01/2019 12:00:00 AM,Date Lost,3800 BROOKLYN AVE NE,SEATTLE,WA,98105,SEATTLE,,,https://petharbor.com/get_image.asp?RES=Detail&LOCATION=PUBLIC&ID=1957934,Image Copyright HLP Inc. 2019,,
K19-115200,A579289,Regional Animal Services of King County,LOST,https://petharbor.com/PublicDetail.asp?searchtype=PUBFOUND&view=sysadm.v_animal&shelterlist='KING'&where=type&ID=1957747,LOST,Benny,Dog,,Male,Miniature Poodle,Unknown,02/01/2019 12:00:00 AM,Date Lost,MONTLAKE BLVD AND E HAMLIN STREET,,,,JURISDICTION,,,https://petharbor.com/get_image.asp?RES=Detail&LOCATION=PUBLIC&ID=1957747,Image Copyright HLP Inc. 2019,,
K19-115079,A578982,Regional Animal Services of King County,FOUND,https://petharbor.com/pet.asp?uaid=KING.A578982,"King County Pet Adoption Center 21615 64TH AVE S KENT, WA 98032",Sirius,Cat,10 MONTHS,Male,Himalayan,Lynx Pt / White,01/25/2019 12:00:00 AM,Received on,3500 S 146TH ST,TUKWILA,WA,98168,TUKWILA,,,https://petharbor.com/get_image.asp?RES=Detail&LOCATION=KING&ID=A578982,Image Copyright HLP Inc. 2019,"Received on: 2019-01-25<p/> Found Near: 3500 S 146TH ST, TUKWILA WA 98168<p/> Description: Lynx Pt / White Male Himalayan Cat<p/> Age: 10 MONTHS<p/> Current Location: King County Pet Adoption Center 21615 64TH AVE S KENT, WA 98032<p/>",BLUE
K19-115212,A579310,Regional Animal Services of King County,LOST,https://petharbor.com/PublicDetail.asp?searchtype=PUBFOUND&view=sysadm.v_animal&shelterlist='KING'&where=type&ID=1957947,LOST,Boston,Dog,,Female,Alaskan Malamute,Unknown,02/02/2019 12:00:00 AM,Date Lost,INTERLAKE AVENUE N & N 40TH ST,SEATTLE,WA,98103,SEATTLE,,,https://petharbor.com/get_image.asp?RES=Detail&LOCATION=PUBLIC&ID=1957947,Image Copyright HLP Inc. 2019,,
K18-106401,A551273,Regional Animal Services of King County,ADOPTABLE,https://kingcounty.gov/depts/regional-animal-services/about-us/overview.aspx,In RASKC Foster Home,Midnight,Cat,13 YEARS,Spayed Female,Domestic Shorthair,Black,02/03/2018 12:00:00 AM,Received on,21615 64TH AVE S,KENT,WA,98032,KING COUNTY,47.407788,-122.255197,https://petharbor.com/get_image.asp?RES=Detail&LOCATION=KING&ID=A551273,Image Copyright HLP Inc. 2019,"Received on: 2018-02-03<p/> Description: Black Spayed Female Domestic Shorthair Cat<p/> Age: 13 YEARS<p/> Current Location: In RASKC Foster Home <p/>Hi! My name is Midnight and I am available for adoption.<p/><p/>I was brought in by my previous owner on  2/3/18.<p/><p/><p/>My personality color is GREEN. I am an adaptable cat who loves to go with the flow! I am outgoing and carefree, and I just can't wait to find my forever home!<p/><p/>I am an affectionate lovebug who would be thrilled to cuddle up with you at home!<p/><p/><p/>My caregivers have noticed that I seem to do well with other cats. When meeting cats in a new home, I would do best with a slow introduction.<p/><p/><p/><p/><p/>Adoption Fee: $30.00<p/>",GREEN
K19-115098,A578999,Regional Animal Services of King County,ADOPTABLE,https://petharbor.com/pet.asp?uaid=KING.A578999,"King County Pet Adoption Center 21615 64TH AVE S KENT, WA 98032",Michael,Rabbit Sh,6 MONTHS,Neutered Male,Rabbit Sh,Gray,01/26/2019 12:00:00 AM,Received on,,,,,,,,https://petharbor.com/get_image.asp?RES=Detail&LOCATION=KING&ID=A578999,Image Copyright HLP Inc. 2019,"Received on: 2019-01-26<p/> Description: Gray<p/>  Neutered Male Rabbit Sh Rabbit Sh<p/> Age: 6 MONTHS<p/> Current Location: King County Pet Adoption Center 21615 64TH AVE S KENT, WA 98032<p/>Hi! My name is Michael and I am available for adoption.<p/><p/>I was brought in by an Animal Control Officer on 1/26/18.<p/><p/>I am only about 7 months old.  I have already been neutered and I am ready to go to my new home!<p/><p/>My personality color is BLUE. I am a gentle and loving bunny who likes to take things slow. I may get nervous in new situations, so I am looking for a family who understands that I might need some time to warm up. Once I get to know you, I will be a very devoted friend!  <p/><p/><p/><p/> Adoption Fee: $30<p/>",
K19-114824,A578233,Regional Animal Services of King County,FOUND,https://petharbor.com/PublicDetail.asp?searchtype=PUBFOUND&view=sysadm.v_animal&shelterlist='KING'&where=type&ID=1951520,In Public Home,,Dog,,Male,Labrador Retriever,Yellow,01/12/2019 12:00:00 AM,Date Found,9400 TEMPLETON AVE SE,SNOQUALMIE,WA,98065,SNOQUALMIE,,,https://petharbor.com/get_image.asp?RES=Detail&LOCATION=PUBLIC&ID=1951520,Image Copyright HLP Inc. 2019,,
K19-115224,A579334,Regional Animal Services of King County,LOST,https://petharbor.com/PublicDetail.asp?searchtype=PUBFOUND&view=sysadm.v_animal&shelterlist='KING'&where=type&ID=1958151,LOST,Googles,Cat,,Male,Domestic Shorthair,Unknown,01/28/2019 12:00:00 AM,Date Lost,108TH AVE S.E AND 116TH AVE SE,,,,JURISDICTION,,,https://petharbor.com/get_image.asp?RES=Detail&LOCATION=PUBLIC&ID=1958151,Image Copyright HLP Inc. 2019,,
K19-115182,A579225,Regional Animal Services of King County,ADOPTABLE,https://petharbor.com/pet.asp?uaid=KING.A579225,"King County Pet Adoption Center 21615 64TH AVE S KENT, WA 98032",Pocahontas,Dog,5 YEARS,Spayed Female,Pit Bull / Mix,Tan,01/31/2019 12:00:00 AM,Received on,,,,,,,,https://petharbor.com/get_image.asp?RES=Detail&LOCATION=KING&ID=A579225,Image Copyright HLP Inc. 2019,"Received on: 2019-01-31<p/> Description: Tan<p/>  Spayed Female Pit Bull / Mix Dog<p/> Age: 5 YEARS<p/> Current Location: King County Pet Adoption Center 21615 64TH AVE S KENT, WA 98032<p/>Hi! My name is Pocahontes and I am available for adoption.<p/><p/>I was transferred in from another shelter on January 31. 2019.<p/><p/>I am a very smart dog! I have shown my caregivers that I already know how to ""sit"" and ""come"".<p/><p/>I am an affectionate lovebug who would be thrilled to cuddle up with you at home!<p/><p/>I am full of energy and I love to play! I tend to calm down more when the people around me stay calm. I do best when I have lots of exercise and something to keep my mind busy.<p/><p/>My caregivers have noticed that I seem to do well with other medium to large dogs. However, I would not be a good fit for a home with cats or small dogs as I tend to enjoy chasing things smaller than me!<p/><p/>My personality color is GREEN. I am an adaptable dog who loves to go with the flow! I am outgoing and carefree, and I just can't wait to find my forever home!<p/><p/> Adoption Fee: $100.00<p/>",GREEN
K19-115134,A579087,Regional Animal Services of King County,FOUND,https://petharbor.com/pet.asp?uaid=KING.A579087,"King County Pet Adoption Center 21615 64TH AVE S KENT, WA 98032",Danni,Cat,8 MONTHS,Spayed Female,Domestic Longhair,Brn Tabby,01/26/2019 12:00:00 AM,Received on,11700 SE 256TH PL,KENT,WA,98030,KENT,,,https://petharbor.com/get_image.asp?RES=Detail&LOCATION=KING&ID=A579087,Image Copyright HLP Inc. 2019,"Received on: 2019-01-26<p/> Found Near: 11700 SE 256TH PL, KENT WA 98030<p/> Description: Brn Tabby Spayed Female Domestic Longhair Cat<p/> Age: 8 MONTHS<p/> Current Location: King County Pet Adoption Center 21615 64TH AVE S KENT, WA 98032<p/>",BLUE
K17-105331,A547918,Regional Animal Services of King County,ADOPTABLE,https://kingcounty.gov/depts/regional-animal-services/about-us/overview.aspx,In RASKC Foster Home,Babette,Cat,18 YEARS 2 MONTHS,Spayed Female,Domestic Shorthair,Brn Tabby,12/04/2017 12:00:00 AM,Received on,21615 64TH AVE S,KENT,WA,98032,KING COUNTY,47.407788,-122.255197,https://petharbor.com/get_image.asp?RES=Detail&LOCATION=KING&ID=A547918,Image Copyright HLP Inc. 2019,"Received on: 2017-12-04<p/> Description: Brn Tabby Spayed Female Domestic Shorthair Cat<p/> Age: 18 YEARS 2 MONTHS<p/> Current Location: In RASKC Foster Home <p/>Hi! My name is Babette and I am available for adoption.<p/><p/>I was brought in by my previous owner on 12/5/17 because the landlord didn't allow cats. I lived in a home with dogs but the were not my favorite. I also lived with other cats and children. My previous owner described me as calm and vocal.<p/><p/>I like getting attention on my own terms. I can get overstimulated with petting, so please move carefully with me and keep an eye out for signs that I might need a break.<p/><p/>Because of my shy nature, I would do best in a calm, quiet home.<p/><p/>My personality color is BLUE. I am a gentle and loving cat who likes to take things slow. I may get nervous in new situations, so I am looking for a family who understands that I might need some time to warm up. Once I get to know you, I will be a very devoted friend!<p/><p/>A veterinarian has diagnosed or tentatively diagnosed the above-described pet with the following condition(s):<p/><p/>1)     This animal has been diagnosed as hyperthyroid.  This means that thyroid gland is producing an excess of hormones.  This disease can be easily managed with daily medication, radioactive iodine treatment or prescription diet.  Please follow up with you regular veterinarian to create a treatment plan.  We have also included a handout with more information about this disease.<p/><p/>2)  This animal has been diagnosed with early kidney disease.  This condition can be managed with special diets and medications.  Treatment will be lifelong.  Please follow up with your regular veterinarian for the best treatment plan.  <p/><p/><p/>As a result of these conditions, your pet may need specialized care consisting of any or all of the below.  Please note this is not intended to be an exhaustive list.<p/><p/>- Special diet or prescription foods<p/>- Prescription or over-the-counter medicines<p/>- Special skin care or shampoos<p/>- Regular veterinarian visits, which may include blood tests or other monitoring<p/>- Possible surgery or other procedures as determined by your veterinarian<p/><p/><p/>Adoption Fee: $30.00<p/>",BLUE
K18-114213,A419454,Regional Animal Services of King County,ADOPTABLE,https://petharbor.com/pet.asp?uaid=KING.A419454,"King County Pet Adoption Center 21615 64TH AVE S KENT, WA 98032",Zoe,Cat,5 YEARS 8 MONTHS,Spayed Female,Domestic Shorthair,Brn Tabby,12/07/2018 12:00:00 AM,Received on,,,,,,,,https://petharbor.com/get_image.asp?RES=Detail&LOCATION=KING&ID=A419454,Image Copyright HLP Inc. 2019,"Received on: 2018-12-07<p/> Description: Brn Tabby<p/>  Spayed Female Domestic Shorthair Cat<p/> Age: 5 YEARS 8 MONTHS<p/> Current Location: King County Pet Adoption Center 21615 64TH AVE S KENT, WA 98032<p/>Hi! My name is Zoe and I am available for adoption.<p/><p/>I was brought in by my previous owner on 12/07/18 because.  My previous owner described me as shy, loving, playful and an alarm clock.<p/><p/>My personality color is BLUE. I am a gentle and loving cat who likes to take things slow. I may get nervous in new situations, so I am looking for a family who understands that I might need some time to warm up. Once I get to know you, I will be a very devoted friend!<p/><p/>I am an affectionate lovebug who would be thrilled to cuddle up with you at home!<p/><p/>I like getting attention on my own terms. I can get overstimulated with petting, so please move carefully with me and keep an eye out for signs that I might need a break.<p/><p/>My caregivers have noticed that I do not seem to get along with other cats, so I may do best as the only cat in my new home.<p/><p/>Because of my shy nature, I would do best in a calm, quiet adult home.<p/><p/>A veterinarian has diagnosed or tentatively diagnosed the above-described pet with the following condition(s):<p/><p/>1)     Mild weakness and incoordination in the hind end- This cat came in with weakness and inccordination in her hind legs.  She was treated with a week of antiinflammatories and has shown some improvement.  Her signs could be due to intervetebral disc disease (""slipped disc"")  or could be caused by other issues such as a degenerative muscle disease.  She is able to move around normally at this point, but she may be having issues using the litterbox.  Please consult with your regular veterinarian about the best treatment plan for her.<p/><p/>2)  Grade 1/6 heart murmur- A heart murmur was detected on physical examination.  This means there is an abnormal heart sound when we listen to the heart.  In some animals, this can indicate heart disease.  However, other animals can have heart murmurs and never show any symptoms of heart disease.  We recommend that you follow up with your regular veterinarian.<p/><p/>As a result of these conditions, your pet may need specialized care consisting of any or all of the below.  Please note this is not intended to be an exhaustive list.<p/><p/>- Special diet or prescription foods<p/>- Prescription or over-the-counter medicines<p/>- Special skin care or shampoos<p/>- Regular veterinarian visits, which may include blood tests or other monitoring<p/>- Possible surgery or other procedures as determined by your veterinarian<p/><p/> Adoption Fee: $30.00<p/>",BLUE
K19-114831,A578238,Regional Animal Services of King County,FOUND,https://petharbor.com/PublicDetail.asp?searchtype=PUBFOUND&view=sysadm.v_animal&shelterlist='KING'&where=type&ID=1951720,In Public Home,,Dog,,Unaltered,Miniature Poodle,White / White,01/13/2019 12:00:00 AM,Date Found,,,,,JURISDICTION,,,https://petharbor.com/get_image.asp?RES=Detail&LOCATION=PUBLIC&ID=1951720,Image Copyright HLP Inc. 2019,,
K19-115241,A579369,Regional Animal Services of King County,LOST,https://petharbor.com/PublicDetail.asp?searchtype=PUBFOUND&view=sysadm.v_animal&shelterlist='KING'&where=type&ID=1958464,LOST,Murphy,Cat,,Male,Domestic Shorthair,Unknown,01/28/2019 12:00:00 AM,Date Lost,26300 185TH AVE SE,COVINGTON,WA,98042,COVINGTON,,,https://petharbor.com/get_image.asp?RES=Detail&LOCATION=PUBLIC&ID=1958464,Image Copyright HLP Inc. 2019,,
K19-115242,A579370,Regional Animal Services of King County,FOUND,https://petharbor.com/PublicDetail.asp?searchtype=PUBFOUND&view=sysadm.v_animal&shelterlist='KING'&where=type&ID=1958518,In Public Home,,Dog,,Female,German Shorthaired Pointer,Brown,02/04/2019 12:00:00 AM,Date Found,900 147TH PL NE,BELLEVUE,WA,98007,BELLEVUE,47.618077,-122.145491,https://petharbor.com/get_image.asp?RES=Detail&LOCATION=PUBLIC&ID=1958518,Image Copyright HLP Inc. 2019,,
K19-115206,A579304,Regional Animal Services of King County,ADOPTABLE,https://petharbor.com/pet.asp?uaid=KING.A579304,"King County Pet Adoption Center 21615 64TH AVE S KENT, WA 98032",Tamara,Rabbit Lh,8 YEARS,Spayed Female,Rabbit Lh,Brown / Cream,02/02/2019 12:00:00 AM,Received on,,,,,,,,https://petharbor.com/get_image.asp?RES=Detail&LOCATION=KING&ID=A579304,Image Copyright HLP Inc. 2019,"Received on: 2019-02-02<p/> Description: Brown / Cream<p/>  Spayed Female Rabbit Lh Rabbit Lh<p/> Age: 8 YEARS<p/> Current Location: King County Pet Adoption Center 21615 64TH AVE S KENT, WA 98032<p/><p/> Adoption Fee: $30.00<p/>",
K19-115205,A579303,Regional Animal Services of King County,ADOPTABLE,https://petharbor.com/pet.asp?uaid=KING.A579303,"King County Pet Adoption Center 21615 64TH AVE S KENT, WA 98032",Tia,Rabbit Lh,8 YEARS,Spayed Female,Rabbit Lh,Brown / Cream,02/02/2019 12:00:00 AM,Received on,,,,,,,,https://petharbor.com/get_image.asp?RES=Detail&LOCATION=KING&ID=A579303,Image Copyright HLP Inc. 2019,"Received on: 2019-02-02<p/> Description: Brown / Cream<p/>  Spayed Female Rabbit Lh Rabbit Lh<p/> Age: 8 YEARS<p/> Current Location: King County Pet Adoption Center 21615 64TH AVE S KENT, WA 98032<p/><p/> Adoption Fee: $30.00<p/>",
K19-115243,A579400,Regional Animal Services of King County,LOST,https://petharbor.com/PublicDetail.asp?searchtype=PUBFOUND&view=sysadm.v_animal&shelterlist='KING'&where=type&ID=1958789,LOST,Dan,Cat,,Male,Domestic Shorthair,Unknown,01/27/2019 12:00:00 AM,Date Lost,UNIT 412,,,,JURISDICTION,,,https://petharbor.com/get_image.asp?RES=Detail&LOCATION=PUBLIC&ID=1958789,Image Copyright HLP Inc. 2019,,
K19-115247,A579417,Regional Animal Services of King County,LOST,https://petharbor.com/PublicDetail.asp?searchtype=PUBFOUND&view=sysadm.v_animal&shelterlist='KING'&where=type&ID=1958938,LOST,Obi,Dog,,Male,Shiba Inu,Unknown,02/05/2019 12:00:00 AM,Date Lost,13900 154TH AVE SE,RENTON,WA,98059,KING COUNTY,,,https://petharbor.com/get_image.asp?RES=Detail&LOCATION=PUBLIC&ID=1958938,Image Copyright HLP Inc. 2019,,
K19-115248,A579418,Regional Animal Services of King County,LOST,https://petharbor.com/PublicDetail.asp?searchtype=PUBFOUND&view=sysadm.v_animal&shelterlist='KING'&where=type&ID=1958969,LOST,Zima,Dog,,Female,Chihuahua - Smooth Coated,Unknown,02/04/2019 12:00:00 AM,Date Lost,1207 S 320TH ST,,,,JURISDICTION,,,https://petharbor.com/get_image.asp?RES=Detail&LOCATION=PUBLIC&ID=1958969,Image Copyright HLP Inc. 2019,,
K18-112172,A568632,Regional Animal Services of King County,ADOPTABLE,https://kingcounty.gov/depts/regional-animal-services/about-us/overview.aspx,In RASKC Foster Home,Astrid,Cat,2 YEARS 4 MONTHS,Spayed Female,Domestic Shorthair,Black,09/16/2018 12:00:00 AM,Received on,21615 64TH AVE S,KENT,WA,98032,KENT,47.407788,-122.255197,https://petharbor.com/get_image.asp?RES=Detail&LOCATION=KING&ID=A568632,Image Copyright HLP Inc. 2019,"Received on: 2018-09-16<p/> Description: Black Spayed Female Domestic Shorthair Cat<p/> Age: 2 YEARS 4 MONTHS<p/> Current Location: In RASKC Foster Home <p/>Hi! My name is Astrid and I am available for adoption.<p/><p/>I was transfered from another Animal Control Agency on 09/16/18. <p/><p/>I am a little nervous around people at first but I do warm up.<p/><p/>I am very vocal and have lots of opinions!<p/><p/><p/>My personality color is BLUE. I am a gentle and loving cat who likes to take things slow. I may get nervous in new situations, so I am looking for a family who understands that I might need some time to warm up. Once I get to know you, I will be a very devoted friend!<p/><p/><p/>Adoption Fee: $30.00<p/>",
K19-115250,A579420,Regional Animal Services of King County,LOST,https://petharbor.com/PublicDetail.asp?searchtype=PUBFOUND&view=sysadm.v_animal&shelterlist='KING'&where=type&ID=1959049,LOST,Benny,Dog,,Male,Miniature Poodle,Unknown,02/01/2019 12:00:00 AM,Date Lost,E ROANOKE ST AND 24TH AVE,,,,JURISDICTION,,,https://petharbor.com/get_image.asp?RES=Detail&LOCATION=PUBLIC&ID=1959049,Image Copyright HLP Inc. 2019,,
K19-115258,A579444,Regional Animal Services of King County,LOST,https://petharbor.com/PublicDetail.asp?searchtype=PUBFOUND&view=sysadm.v_animal&shelterlist='KING'&where=type&ID=1959154,LOST,Trigger,Dog,,Male,Pit Bull,Unknown,02/02/2019 12:00:00 AM,Date Lost,20200 SE 24TH ST,SAMMAMISH,WA,98075,SAMMAMISH,,,https://petharbor.com/get_image.asp?RES=Detail&LOCATION=PUBLIC&ID=1959154,Image Copyright HLP Inc. 2019,,
K19-115259,A579451,Regional Animal Services of King County,LOST,https://petharbor.com/PublicDetail.asp?searchtype=PUBFOUND&view=sysadm.v_animal&shelterlist='KING'&where=type&ID=1959206,LOST,Shadow,Cat,,Female,Himalayan,Unknown,02/01/2019 12:00:00 AM,Date Lost,230TH PL SE,,,,JURISDICTION,,,https://petharbor.com/get_image.asp?RES=Detail&LOCATION=PUBLIC&ID=1959206,Image Copyright HLP Inc. 2019,,
K19-115261,A579456,Regional Animal Services of King County,LOST,https://petharbor.com/PublicDetail.asp?searchtype=PUBFOUND&view=sysadm.v_animal&shelterlist='KING'&where=type&ID=1959222,LOST,Daisy,Cat,,Female,Domestic Mediumhair,Unknown,02/03/2019 12:00:00 AM,Date Lost,18700 129TH CT NE,BOTHELL,WA,98011,BOTHELL,,,https://petharbor.com/get_image.asp?RES=Detail&LOCATION=PUBLIC&ID=1959222,Image Copyright HLP Inc. 2019,,
K19-115269,A579470,Regional Animal Services of King County,LOST,https://petharbor.com/PublicDetail.asp?searchtype=PUBFOUND&view=sysadm.v_animal&shelterlist='KING'&where=type&ID=1959387,LOST,Koko,Dog,,Male,Toy Poodle,Unknown,02/05/2019 12:00:00 AM,Date Lost,UNIT 26,,,,JURISDICTION,,,https://petharbor.com/get_image.asp?RES=Detail&LOCATION=PUBLIC&ID=1959387,Image Copyright HLP Inc. 2019,,
K19-114692,A572568,Regional Animal Services of King County,ADOPTABLE,https://petharbor.com/pet.asp?uaid=KING.A572568,"King County Pet Adoption Center 21615 64TH AVE S KENT, WA 98032",Reece,Dog,6 YEARS 3 MONTHS,Neutered Male,German Shepherd,Black / Tan,01/04/2019 12:00:00 AM,Received on,,,,,,,,https://petharbor.com/get_image.asp?RES=Detail&LOCATION=KING&ID=A572568,Image Copyright HLP Inc. 2019,"Received on: 2019-01-04<p/> Description: Black / Tan<p/>  Neutered Male German Shepherd Dog<p/> Age: 6 YEARS 3 MONTHS<p/> Current Location: King County Pet Adoption Center 21615 64TH AVE S KENT, WA 98032<p/>Hi! My name is Reece and I am available for adoption.<p/><p/>I was brought in on January 4, 2019 because I had a tendancy to get too riled up when playing. I'm very sweet and love to play, but sometimes I forget how big I am!<p/><p/>I'm a sweet guy who is looking for a nice, calm, relaxing home that I can chill out and hang out with my people. BALL IS LIFE! I absolutely love to play fetch, and can literally play ALL DAY LONG! I am a very smart dog! I have shown my caregivers that I already know how to ""sit"" and bring the ball back to my people. My caregivers have noticed that I seem to do well with other large dogs. When meeting dogs in a new home, I would do best with a slow introduction. I do have some handling sensitivity when it comes to being pet around my rump and hips but sure do love to be pet on my shoulders and head! <p/><p/>I may be to much for small animals so I should be in a home that has creatures my size or only a little smaller. <p/><p/>My personality color is RED. I am a spirited dog with a fun-loving personality! I am still working on my manners, so I would do best with a family who is willing to work with me and help me become the best dog I can be!<p/> Adoption Fee: $150.00<p/>",RED
K18-113628,A574398,Regional Animal Services of King County,ADOPTABLE,https://kingcounty.gov/depts/regional-animal-services/about-us/overview.aspx,In RASKC Foster Home,Charlie,Cat,18 YEARS 3 MONTHS,Neutered Male,Domestic Longhair,Gray / White,11/08/2018 12:00:00 AM,Received on,21615 64TH AVE S,KENT,WA,98032,KING COUNTY,47.407788,-122.255197,https://petharbor.com/get_image.asp?RES=Detail&LOCATION=KING&ID=A574398,Image Copyright HLP Inc. 2019,"Received on: 2018-11-08<p/> Description: Gray / White Neutered Male Domestic Longhair Cat<p/> Age: 18 YEARS 3 MONTHS<p/> Current Location: In RASKC Foster Home <p/>Hi! My name is Charlie aka Sir Charlie, and I am available for adoption.<p/><p/>I was brought in by my previous owner on November 8th, 2018, because my owner was moving into a home with residents that were allergic to cats. I lived in a home with a rottweiler. My previous owner described me as shy at first but once I get to know you I can be very lovey and snuggley.<p/><p/>I'm a big time sweetie guy who is looking for my forever home, I previously lived in a home that allowed me indoor/outdoor access to 3 acres of backyard and wooded area. I really love to sleep in my persons bed and snuggle with them at night. Take me home and have a best friend for life! <p/><p/>My personality color is BLUE. I am a gentle and loving cat who likes to take things slow. I may get nervous in new situations, so I am looking for a family who understands that I might need some time to warm up. Once I get to know you, I will be a very devoted friend!<p/><p/>Adoption Fee: $30.00<p/>",BLUE
K19-115264,A578246,Regional Animal Services of King County,ADOPTABLE,https://petharbor.com/pet.asp?uaid=KING.A578246,"King County Pet Adoption Center 21615 64TH AVE S KENT, WA 98032",Biscuit,Dog,9 YEARS 10 MONTHS,Neutered Male,Pomeranian,Black,02/06/2019 12:00:00 AM,Received on,,,,,,,,https://petharbor.com/get_image.asp?RES=Detail&LOCATION=KING&ID=A578246,Image Copyright HLP Inc. 2019,"Received on: 2019-02-06<p/> Description: Black<p/>  Neutered Male Pomeranian Dog<p/> Age: 9 YEARS 10 MONTHS<p/> Current Location: King County Pet Adoption Center 21615 64TH AVE S KENT, WA 98032<p/>Hi! My name is Biscuit and I am available for adoption.<p/><p/>I was brought in by my previous owner on January 13, 2019 because they were unable to have me in the apartment. I lived in a home with other cats/dogs, young/older children. My previous owner described me as outgoing and loving.<p/><p/>I am an affectionate lovebug who would be thrilled to cuddle up with you at home!<p/><p/>My caregivers have noticed that I seem to do well with other small dogs. When meeting dogs in a new home, I would do best with a slow introduction.<p/><p/>My personality color is GREEN. I am an adaptable dog who loves to go with the flow! I am outgoing and carefree, and I just can't wait to find my forever home!<p/> Adoption Fee: $100.00<p/>",GREEN
K19-115285,A579517,Regional Animal Services of King County,LOST,https://petharbor.com/PublicDetail.asp?searchtype=PUBFOUND&view=sysadm.v_animal&shelterlist='KING'&where=type&ID=1959665,LOST,Sierra,Dog,,Female,German Shepherd,Unknown,02/07/2019 12:00:00 AM,Date Lost,H106,,,,JURISDICTION,,,https://petharbor.com/get_image.asp?RES=Detail&LOCATION=PUBLIC&ID=1959665,Image Copyright HLP Inc. 2019,,
K19-115080,A577314,Regional Animal Services of King County,ADOPTABLE,https://petharbor.com/pet.asp?uaid=KING.A577314,"King County Pet Adoption Center 21615 64TH AVE S KENT, WA 98032",Bibsy,Cat,2 YEARS 1 MONTH,Spayed Female,Domestic Shorthair,Black / White,01/25/2019 12:00:00 AM,Received on,,,,,,,,https://petharbor.com/get_image.asp?RES=Detail&LOCATION=KING&ID=A577314,Image Copyright HLP Inc. 2019,"Received on: 2019-01-25<p/> Description: Black / White<p/>  Spayed Female Domestic Shorthair Cat<p/> Age: 2 YEARS 1 MONTH<p/> Current Location: King County Pet Adoption Center 21615 64TH AVE S KENT, WA 98032<p/>Hi! My name is Bibsy and I am available for adoption.<p/><p/>I was brought in by my previous owner on 1/25/19  because they didn't know how to care for me properly.<p/><p/>My personality color is RED. I am a spirited little cat with a fun-loving personality!  I am very affectionate and love your attention.  When I am being petted for a long time I will give gentle love bites.<p/><p/>I have lots of energy and love to play.  You may think I am calm and shy at first, but once I am comfortable with you, you'll see my true playful self!  I am still a kitten at heart. <p/><p/>My caregivers have noticed that I seem to do okay with other cats. When meeting cats in a new home, I would do best with a slow introduction.<p/><p/><p/> Adoption Fee: $30.00<p/>",RED
K19-115193,A579274,Regional Animal Services of King County,FOUND,https://petharbor.com/pet.asp?uaid=KING.A579274,"King County Pet Adoption Center 21615 64TH AVE S KENT, WA 98032",Cranberry,Cat,4 YEARS,Spayed Female,Siamese,Tortie Pt / Lynx Pt,02/01/2019 12:00:00 AM,Received on,24100 200TH AVE SE,MAPLE VALLEY,WA,98038,KING COUNTY,,,https://petharbor.com/get_image.asp?RES=Detail&LOCATION=KING&ID=A579274,Image Copyright HLP Inc. 2019,"Received on: 2019-02-01<p/> Found Near: 24100 200TH AVE SE, MAPLE VALLEY WA 98038<p/> Description: Tortie Pt / Lynx Pt Spayed Female Siamese Cat<p/> Age: 4 YEARS<p/> Current Location: King County Pet Adoption Center 21615 64TH AVE S KENT, WA 98032<p/>",
K18-112966,A571724,Regional Animal Services of King County,ADOPTABLE,https://petharbor.com/pet.asp?uaid=KING.A571724,"King County Pet Adoption Center 21615 64TH AVE S KENT, WA 98032",Timmy,Cat,10 YEARS 3 MONTHS,Neutered Male,Domestic Longhair,Brn Tabby / White,10/15/2018 12:00:00 AM,Received on,,,,,,,,https://petharbor.com/get_image.asp?RES=Detail&LOCATION=KING&ID=A571724,Image Copyright HLP Inc. 2019,"Received on: 2018-10-15<p/> Description: Brn Tabby / White<p/>  Neutered Male Domestic Longhair Cat<p/> Age: 10 YEARS 3 MONTHS<p/> Current Location: King County Pet Adoption Center 21615 64TH AVE S KENT, WA 98032<p/>Hi! My name is Timmy and I am available for adoption.<p/><p/>I was brought in by my previous owner because they weren't allowed to have me where they lived.  My previous owner described me as friendly and outgoing.<p/><p/>My personality color is RED. I am spirited cat with a fun-loving personality!   I love to play, climb and explore my surroundings! I am a big cool playful cat!  I can be quite affectionate with calm people that I trust, but do get overstimulated with petting.  I prefer pets on my head, cheeks and chin.  I love to sit on laps, but please do not pick me up, I will happily jump onto your lap!  I would do best with a cat savvy family that knows when to give me some space.  <p/><p/>I am declawed on my front feet, so I will need to remain an indoor cat only.  <p/><p/>My caregivers have noticed that I do not seem to get along with other cats, I would like to be the King Cat of the house please!<p/><p/><p/> Adoption Fee: $30.00<p/>",RED
K19-114773,A573784,Regional Animal Services of King County,ADOPTABLE,https://petharbor.com/pet.asp?uaid=KING.A573784,"King County Pet Adoption Center 21615 64TH AVE S KENT, WA 98032",Bella,Cat,1 YEAR 3 MONTHS,Spayed Female,Domestic Shorthair,Brn Tabby,01/10/2019 12:00:00 AM,Received on,,,,,,,,https://petharbor.com/get_image.asp?RES=Detail&LOCATION=KING&ID=A573784,Image Copyright HLP Inc. 2019,"Received on: 2019-01-10<p/> Description: Brn Tabby<p/>  Spayed Female Domestic Shorthair Cat<p/> Age: 1 YEAR 3 MONTHS<p/> Current Location: King County Pet Adoption Center 21615 64TH AVE S KENT, WA 98032<p/>Hi! My name is Bella and I am available for adoption.<p/><p/>My personality color is RED. I am a spirited cat with a fun-loving personality! I may be sensitive to handling, so I would do best in a home with a cat savvy family who knows when to give me some space.<p/><p/>I'm a spunky and fun-loving little kitty ready for my furrrever home!  I'm such a sweetie and I love to play!<p/><p/>I like getting attention on my own terms. I can get overstimulated with petting, so please move carefully with me and keep an eye out for signs that I might need a break.<p/><p/>My caregivers have noticed that I do not seem to get along with other cats, so I may do best as the only cat in my new home.<p/><p/> Adoption Fee: $30.00<p/>",RED
K19-114743,A578094,Regional Animal Services of King County,ADOPTABLE,https://petharbor.com/pet.asp?uaid=KING.A578094,"King County Pet Adoption Center 21615 64TH AVE S KENT, WA 98032",Cali,Cat,10 YEARS 1 MONTH,Spayed Female,Domestic Shorthair,Tortie,01/08/2019 12:00:00 AM,Received on,,,,,,,,https://petharbor.com/get_image.asp?RES=Detail&LOCATION=KING&ID=A578094,Image Copyright HLP Inc. 2019,"Received on: 2019-01-08<p/> Description: Tortie<p/>  Spayed Female Domestic Shorthair Cat<p/> Age: 10 YEARS 1 MONTH<p/> Current Location: King County Pet Adoption Center 21615 64TH AVE S KENT, WA 98032<p/>Hi! My name is Cali and I am available for adoption.<p/><p/>I was brought in by my previous owners because they no longer could care for me due to their health declining.  My previous owner described me as affectionate.<p/><p/>My personality color is RED.  I am a quiet and calm cat that enjoys sleeping most of the day! I like people and can be quite affectionate, but please only pe me on my head and chin.  I am sensitive to being touched on my back or being picked up.  <p/><p/>If your looking for a sweet quiet girl to keep you company and cozy up on your lap, thats me!  I look forward to meeting my new furrever family!<p/><p/>I would do best in a quiet home with older children and only calm pets.  My caregivers have noticed I am okay with other cats as long as they are calm and not in my immediate space.  <p/><p/><p/> Adoption Fee: $30.00<p/>",RED
K19-115291,A579534,Regional Animal Services of King County,LOST,https://petharbor.com/PublicDetail.asp?searchtype=PUBFOUND&view=sysadm.v_animal&shelterlist='KING'&where=type&ID=1959807,LOST,Lynx,Cat,,Male,Bengal,Unknown,02/01/2019 12:00:00 AM,Date Lost,20200 269TH AVE SE,MAPLE VALLEY,WA,98038,KING COUNTY,,,https://petharbor.com/get_image.asp?RES=Detail&LOCATION=PUBLIC&ID=1959807,Image Copyright HLP Inc. 2019,,
K19-115266,A579460,Regional Animal Services of King County,FOUND,https://petharbor.com/pet.asp?uaid=KING.A579460,"King County Pet Adoption Center 21615 64TH AVE S KENT, WA 98032",Ned,Cat,11 YEARS,Neutered Male,Domestic Shorthair,Black,02/06/2019 12:00:00 AM,Received on,30000 164TH AVE SE,KENT,WA,98042,KING COUNTY,,,https://petharbor.com/get_image.asp?RES=Detail&LOCATION=KING&ID=A579460,Image Copyright HLP Inc. 2019,"Received on: 2019-02-06<p/> Found Near: 30000 164TH AVE SE, KENT WA 98042<p/> Description: Black Neutered Male Domestic Shorthair Cat<p/> Age: 11 YEARS<p/> Current Location: King County Pet Adoption Center 21615 64TH AVE S KENT, WA 98032<p/>",GREEN
K19-114769,A395796,Regional Animal Services of King County,ADOPTABLE,https://petharbor.com/pet.asp?uaid=KING.A395796,"King County Pet Adoption Center 21615 64TH AVE S KENT, WA 98032",Jasmin,Cat,10 YEARS 1 MONTH,Spayed Female,Domestic Longhair,Brn Tabby,01/10/2019 12:00:00 AM,Received on,,,,,,,,https://petharbor.com/get_image.asp?RES=Detail&LOCATION=KING&ID=A395796,Image Copyright HLP Inc. 2019,"Received on: 2019-01-10<p/> Description: Brn Tabby<p/>  Spayed Female Domestic Longhair Cat<p/> Age: 10 YEARS 1 MONTH<p/> Current Location: King County Pet Adoption Center 21615 64TH AVE S KENT, WA 98032<p/>Hi! My name is Jasmin and I am available for adoption.<p/><p/>I was brought in by my previous owner on January 10, 2019 because they were unable to care for me.<p/><p/>My personality color is RED. I am a spirited cat with a fun-loving personality! I may be sensitive to handling, so I would do best in a home with a cat savvy family who knows when to give me some space.<p/><p/>I like getting attention on my own terms. I can get overstimulated with petting, so please move carefully with me and keep an eye out for signs that I might need a break.<p/><p/> Adoption Fee: $30.00<p/>",RED
K19-115214,A579312,Regional Animal Services of King County,ADOPTABLE,https://petharbor.com/pet.asp?uaid=KING.A579312,"King County Pet Adoption Center 21615 64TH AVE S KENT, WA 98032",Tesla,Dog,3 YEARS 6 MONTHS,Spayed Female,Labrador Retriever / Mix,Black / White,02/02/2019 12:00:00 AM,Received on,,,,,,,,https://petharbor.com/get_image.asp?RES=Detail&LOCATION=KING&ID=A579312,Image Copyright HLP Inc. 2019,"Received on: 2019-02-02<p/> Description: Black / White<p/>  Spayed Female Labrador Retriever / Mix Dog<p/> Age: 3 YEARS 6 MONTHS<p/> Current Location: King County Pet Adoption Center 21615 64TH AVE S KENT, WA 98032<p/>Meet Tesla!<p/><p/>This sweet gal was brought into the shelter with her adopted sister, Luna, on 2/2/19.<p/><p/>We have noticed that Tesla seems to do well with other dogs. She has lived with dogs small and large. She will however chase cats given the opportunity. When meeting dogs in a new home, she would do best with a slow introduction.<p/><p/>Tesla relies on her dog sister, Luna, to show her the world is not such a scary place. She appears to be much more comfortable when she is with her companion. Tesla is slow to warm up to new people but she eventually does and is very affectionate. Because of her shy nature, she would do best in a calm, quiet home.<p/><p/>Tesla is house trained and crate trained.<p/><p/>Her personality color is BLUE. She is a gentle and loving dog who likes to take things slow. She may get nervous in new situations, so she am looking for a family who understands that Tesla might take some time to warm up. Once she gets to know you, she will be a very devoted friend!<p/><p/>Come meet lovely Tesla today!<p/><p/> Adoption Fee: $250.00<p/>",BLUE
K18-113004,A571907,Regional Animal Services of King County,ADOPTABLE,https://kingcounty.gov/depts/regional-animal-services/about-us/overview.aspx,In RASKC Foster Home,Prince,Cat,6 YEARS 3 MONTHS,Neutered Male,Domestic Mediumhair,Brn Tabby,10/16/2018 12:00:00 AM,Received on,21615 64TH AVE S,KENT,WA,98032,BELLEVUE,47.407788,-122.255197,https://petharbor.com/get_image.asp?RES=Detail&LOCATION=KING&ID=A571907,Image Copyright HLP Inc. 2019,"Received on: 2018-10-16<p/> Description: Brn Tabby Neutered Male Domestic Mediumhair Cat<p/> Age: 6 YEARS 3 MONTHS<p/> Current Location: In RASKC Foster Home <p/>Hi! My name is Prince and I am available for adoption.<p/><p/>I was brought in by an Animal Control Officer on October 16, 2018. <p/><p/>I have been in foster care because when I arrived at the shelter I was ill. But I'm feeling all better and I am ready to find my forever home!  My foster mom said that I'm very sweet and mellow, and I love to cuddle. I even prefer to sleep in bed with my humans!  I have beautiful fur and I love to be brushed!<p/><p/>My personality color is GREEN. I am an adaptable cat who loves to go with the flow! I am outgoing and carefree, and I just can't wait to find my forever home!<p/><p/><p/>Adoption Fee: An Adoption Fee has not been set. Please inquire with the shelter.<p/>",GREEN
K19-115297,A579550,Regional Animal Services of King County,LOST,https://petharbor.com/PublicDetail.asp?searchtype=PUBFOUND&view=sysadm.v_animal&shelterlist='KING'&where=type&ID=1959985,LOST,Boomer/johny,Cat,,Male,Norwegian Forest Cat,Unknown,01/09/2019 12:00:00 AM,Date Lost,130TH AND NE 8TH STREET,,,,JURISDICTION,,,https://petharbor.com/get_image.asp?RES=Detail&LOCATION=PUBLIC&ID=1959985,Image Copyright HLP Inc. 2019,,
K19-115225,A579337,Regional Animal Services of King County,FOUND,https://petharbor.com/pet.asp?uaid=KING.A579337,"King County Pet Adoption Center 21615 64TH AVE S KENT, WA 98032",Nyssa,Cat,10 WEEKS,Female,Domestic Shorthair,Black / White,02/03/2019 12:00:00 AM,Received on,22800 126TH PL SE,KENT,WA,98031,KENT,,,https://petharbor.com/get_image.asp?RES=Detail&LOCATION=KING&ID=A579337,Image Copyright HLP Inc. 2019,"Received on: 2019-02-03<p/> Found Near: 22800 126TH PL SE, KENT WA 98031<p/> Description: Black / White Female Domestic Shorthair Cat<p/> Age: 10 WEEKS<p/> Current Location: King County Pet Adoption Center 21615 64TH AVE S KENT, WA 98032<p/>",
K19-115311,A579634,Regional Animal Services of King County,FOUND,https://kingcounty.gov/depts/regional-animal-services/about-us/overview.aspx,,,Dead Dog,NO AGE,Female,Pekingese,White,02/11/2019 12:00:00 AM,Received on,22700 SE 392ND ST,ENUMCLAW,WA,98022,KING COUNTY,,,,Image Copyright HLP Inc. 2019,"Received on: 2019-02-11<p/> Found Near: 22700 SE 392ND ST, ENUMCLAW WA 98022<p/> Description: White Female Pekingese Dog<p/> Age: NO AGE<p/>",
K19-115299,A579597,Regional Animal Services of King County,LOST,https://petharbor.com/PublicDetail.asp?searchtype=PUBFOUND&view=sysadm.v_animal&shelterlist='KING'&where=type&ID=1960563,LOST,Bella,Dog,,Female,Pit Bull,Unknown,02/10/2019 12:00:00 AM,Date Lost,500 NE 131ST PL,SEATTLE,WA,98125,SEATTLE,,,https://petharbor.com/get_image.asp?RES=Detail&LOCATION=PUBLIC&ID=1960563,Image Copyright HLP Inc. 2019,,
K18-109087,A497023,Regional Animal Services of King County,ADOPTABLE,https://petharbor.com/pet.asp?uaid=KING.A497023,"King County Pet Adoption Center 21615 64TH AVE S KENT, WA 98032",Sasha,Cat,8 YEARS 8 MONTHS,Spayed Female,Domestic Longhair,Tortie / Gray,06/08/2018 12:00:00 AM,Received on,,,,,,,,https://petharbor.com/get_image.asp?RES=Detail&LOCATION=KING&ID=A497023,Image Copyright HLP Inc. 2019,"Received on: 2018-06-08<p/> Description: Tortie / Gray<p/>  Spayed Female Domestic Longhair Cat<p/> Age: 8 YEARS 8 MONTHS<p/> Current Location: King County Pet Adoption Center 21615 64TH AVE S KENT, WA 98032<p/>Hi! My name is Sasha and I am available for adoption.<p/><p/>I was brought in by my previous owner because the other cat in the house was stalking me and I did not like it.  They said I am a sweet cat that likes to be petted and belly rubs, but felt it was best to find her a new home where she could be the only cat.<p/><p/>My personality color is RED. I am a spirited and playful cat with a fun-loving personality!  I am affectionate and enjoy getting attention, but I can get overstimulated, so please look for signs that I am done being petted.  <p/><p/>My caregivers have noticed, I do not get along with other cats.  I would do best as the only pet in the home.<p/> Adoption Fee: $30.00<p/>",
K19-115302,A579616,Regional Animal Services of King County,FOUND,https://petharbor.com/PublicDetail.asp?searchtype=PUBFOUND&view=sysadm.v_animal&shelterlist='KING'&where=type&ID=1960777,In Public Home,,Dog,,Female,Alaskan Husky,Brown,02/08/2019 12:00:00 AM,Date Found,12TH AVE S AND S PEARL ST,,,,JURISDICTION,,,https://petharbor.com/get_image.asp?RES=Detail&LOCATION=PUBLIC&ID=1960777,Image Copyright HLP Inc. 2019,,
K19-115113,A579033,Regional Animal Services of King County,FOUND,https://petharbor.com/pet.asp?uaid=KING.A579033,"King County Pet Adoption Center 21615 64TH AVE S KENT, WA 98032",Rue,Cat,NO AGE,Female,Domestic Longhair,Black,01/27/2019 12:00:00 AM,Received on,11700 SE 256TH PL,KENT,WA,98030,KENT,,,https://petharbor.com/get_image.asp?RES=Detail&LOCATION=KING&ID=A579033,Image Copyright HLP Inc. 2019,"Received on: 2019-01-27<p/> Found Near: 11700 SE 256TH PL, KENT WA 98030<p/> Description: Black Female Domestic Longhair Cat<p/> Age: NO AGE<p/> Current Location: King County Pet Adoption Center 21615 64TH AVE S KENT, WA 98032<p/>",BLUE
K1_-______,A557862,Regional Animal Services of King County,ADOPTABLE,https://petharbor.com/pet.asp?uaid=KING.A557862,"King County Pet Adoption Center 21615 64TH AVE S KENT, WA 98032",Shasta,Dog,1 YEAR -1 MONTHS,Spayed Female,Pointer / Mix,White / Red,02/02/2019 12:00:00 AM,Received on,,,,,,,,https://petharbor.com/get_image.asp?RES=Detail&LOCATION=KING&ID=A557862,Image Copyright HLP Inc. 2019,"Received on: 2019-02-02<p/> Description: White / Red<p/>  Spayed Female Pointer / Mix Dog<p/> Age: 1 YEAR -1 MONTHS<p/> Current Location: King County Pet Adoption Center 21615 64TH AVE S KENT, WA 98032<p/>Hi! My name is Shasta and I am available for adoption.<p/><p/>I was brought in by my previous owner on February 2, 2019  because their household was changing and that made me uncomfortable. I have lived in a home with another female dog and young children and I would like to live with a confident and stable dog. My previous owner described me as affectionate, shy, loving, and active.<p/><p/>My personality color is BLUE. I am a gentle and loving dog who likes to take things slow. I may get nervous in new situations, so I am looking for a family who understands that I might take some time to warm up. Once I get to know you, I will be a very devoted friend!<p/><p/>I am a nervous girl in the shelter environment, but I warm up quickly once I learn to trust you.  I am generally friendly with other dogs, but I would like to meet them first to make sure we're compatible.  I would be most suitable for a calm home that is ready to help me to become more socialized with different environments. But, I am very friendly and easy going with most people!<p/> Adoption Fee: $225.00<p/>",BLUE
K19-115312,A579635,Regional Animal Services of King County,LOST,https://petharbor.com/PublicDetail.asp?searchtype=PUBFOUND&view=sysadm.v_animal&shelterlist='KING'&where=type&ID=1960910,LOST,Goob,Cat,,Male,Russian Blue,Unknown,02/06/2019 12:00:00 AM,Date Lost,22400 SE 296TH ST,BLACK DIAMOND,WA,98010,BLACK DIAMOND,,,https://petharbor.com/get_image.asp?RES=Detail&LOCATION=PUBLIC&ID=1960910,Image Copyright HLP Inc. 2019,,
K19-114730,A578047,Regional Animal Services of King County,ADOPTABLE,https://kingcounty.gov/depts/regional-animal-services/about-us/overview.aspx,In RASKC Foster Home,Lina,Dog,3 YEARS 1 MONTH,Spayed Female,Jack Russell Terrier / Mix,Red / White,01/07/2019 12:00:00 AM,Received on,21615 64TH AVE S,KENT,WA,98032,KENT,47.407788,-122.255197,https://petharbor.com/get_image.asp?RES=Detail&LOCATION=KING&ID=A578047,Image Copyright HLP Inc. 2019,"Received on: 2019-01-07<p/> Description: Red / White Spayed Female Jack Russell Terrier / Mix Dog<p/> Age: 3 YEARS 1 MONTH<p/> Current Location: In RASKC Foster Home <p/>Lina:.<p/><p/>Lina is a gentle loving dog who likes to take things slow. I may get nervous in new situations. It takes me a bit to warm up to strangers but when I do I'm all about cuddles and snuggles!<p/><p/>I need some work while on a leash. I tend to pull and want to explore. I can be a little vocal when I see people in my front yard, or other dogs while I'm on a walk, but settle down with some reassurance form me foster mom. I love toys and enjoy playing in my back yard. I may be 3 years old but still have a puppy spirit and would love some training and learn some tricks!<p/><p/>My Foster home has a 4 year old child and I do well with her if she is gentle and loving. I play with my puppies but it's been awhile since I've been around other adult dogs so a slow introduction may be best. I may want to be the only dog in the home. It's all about the right connections.<p/><p/>I'm looking for a forever home with lots of love and attention. I get sad when my Foster mom goes to work. I get so excited when she comes home and jump for JOY!<p/>Adoption Fee: An Adoption Fee has not been set. Please inquire with the shelter.<p/>",
K19-115295,A579547,Regional Animal Services of King County,ADOPTABLE,https://petharbor.com/pet.asp?uaid=KING.A579547,"King County Pet Adoption Center 21615 64TH AVE S KENT, WA 98032",Morris,Cat,10 YEARS,Neutered Male,Domestic Shorthair,Org Tabby,02/08/2019 12:00:00 AM,Received on,,,,,,,,https://petharbor.com/get_image.asp?RES=Detail&LOCATION=KING&ID=A579547,Image Copyright HLP Inc. 2019,"Received on: 2019-02-08<p/> Description: Org Tabby<p/>  Neutered Male Domestic Shorthair Cat<p/> Age: 10 YEARS<p/> Current Location: King County Pet Adoption Center 21615 64TH AVE S KENT, WA 98032<p/>Hi! My name is Morris and I am available for adoption.<p/><p/>I was brought in by a good samaritan on February 8th, 2018.<p/><p/>I'm a sweet, dainty, gentle, older guy who is looking for a nice, calm, relaxing home that I can kick back and relax in! I really love to sleep in and snooze the day away, binge all the shows on netflix, curl up to a great read or hang out by the fire. <p/><p/>My personality color is GREEN. I am an adaptable cat who loves to go with the flow! I am outgoing and carefree, and I just can't wait to find my forever home!<p/><p/> Adoption Fee: $30.00<p/>",GREEN
K19-115314,A579648,Regional Animal Services of King County,FOUND,https://petharbor.com/pet.asp?uaid=KING.A579648,"King County Pet Adoption Center 21615 64TH AVE S KENT, WA 98032",Budders,Dog,6 YEARS 8 MONTHS,Neutered Male,Labrador Retriever,Black,02/12/2019 12:00:00 AM,Received on,43100 208TH AVE SE,ENUMCLAW,WA,98022,KING COUNTY,,,https://petharbor.com/get_image.asp?RES=Detail&LOCATION=KING&ID=A579648,Image Copyright HLP Inc. 2019,"Received on: 2019-02-12<p/> Found Near: 43100 208TH AVE SE, ENUMCLAW WA 98022<p/> Description: Black Neutered Male Labrador Retriever Dog<p/> Age: 6 YEARS 8 MONTHS<p/> Current Location: King County Pet Adoption Center 21615 64TH AVE S KENT, WA 98032<p/>",
K19-115276,A579497,Regional Animal Services of King County,FOUND,https://petharbor.com/pet.asp?uaid=KING.A579497,"King County Pet Adoption Center 21615 64TH AVE S KENT, WA 98032",Warner,Cat,1 YEAR,Male,Domestic Shorthair,Black,02/07/2019 12:00:00 AM,Received on,21400 NE NOVELTY HILL RD,REDMOND,WA,98053,KING COUNTY,47.691923,-122.055537,https://petharbor.com/get_image.asp?RES=Detail&LOCATION=KING&ID=A579497,Image Copyright HLP Inc. 2019,"Received on: 2019-02-07<p/> Found Near: 21400 NE NOVELTY HILL RD, REDMOND WA 98053<p/> Description: Black Male Domestic Shorthair Cat<p/> Age: 1 YEAR<p/> Current Location: King County Pet Adoption Center 21615 64TH AVE S KENT, WA 98032<p/>",GREEN
